Song,Artist,Album,Lyrics
"""Nakalimutan Kong Sabihin""",Christian Bautista,"""Captured""","

[Intro:]
Bakit laging sa huli ang pagiingat, ang pagsisisi
nung ika'y kapiling pa minahal mo ako ngunit di ko nasabi
sino ka ba, sa aking puso
nagbago ka

[Chorus:]
nakalimutan kong sabihin, di ko pinansin ang iyong damdamin
nang ikaw ay lumisan saka ko nalaman mahal pala kita
nakalimutan kong sabihin sana'y di pa huli ang lahat
nakikiusap ako, nagmamakaawa sa'yo
patawarin mo sana, nakalimutan kong sabihin mahal kita

kung maibabalik ko lang ang sandaling ika'y kapiling
asahang iingatan ko ang pagibig mo di ko sasayangin
alam ko na, kung sino ka sa puso ko
kung kailan pa

[Repeat chorus]

[Bridge:]
akala ko di ka magbabago

[Chorus:]
nakalimutan kong sabihin, di ko pinansin ang iyong damdamin
nang ikaw ay lumisan saka ko nalaman mahal pala kita
nakalimutan kong sabihin sanay di pa huli ang lahat
nakikiusap ako, nagmamakaawa sa'yo
patawarin mo sana, nakalimutan kong sabihin mahal kita

...mahal kita
"
"""Could Have Been The One""",Christian Bautista,"""Captured""","

I just love that look in your face
And makin every life your beautiful life
He's hurt you once again
He's leavin you and then
Your crying you hearts to an old friend

As I am now holding you
Trying hard to stop myself
From telling you
That I'm dying inside
That I'm trying to hide
All the feelings that I have for you

Could have been the once to love you
I could have been the one to hold you tight
Be the one to make you see brighter days
Through those lonely nights
I know that you can never really understand
What I'm feeling inside
All I want is for you to know
That I could have been the one

Ohhhhh and I could not believe
That we can never be more than just friends
For in my heart I know that you and I
Will be together in the end
In the end!!!

I could have been the one to love you
Could have been the one to hold you tight
Be the one to make you see brighter days
Through those lonely nights
I know that you can never really understand
What I'm feeling inside
All I want is for you to know

I could have been the one to love you
Could have been the one to hold you tight
Be the one to make you see brighter days
Through those lonely nights
I know that you can never really understand
What I'm feeling inside
All I want is for you to know

That I could have been the one....
I could have been the one....
"
"""Captured""",Christian Bautista,"""Captured""","

I was captured the moment we met
Carried away with every word you said
It's a mystery how you got to me
I fell in the spell of your charms
With your siren's smile you caught me off guard

Just one glance took away my breath
Then you drew me in with your tenderness
You captivate my soul, I'm enraptured
You knocked me out and you locked me up
Stole my heart like a thief at love
Keep me here in your happy ever after
I'm captured

By the way just in case you care
I'm here to stay, I'm not going anywhere
I took a dive in your deep dark eyes
And I'm never coming up for air
I lost myself in this bond that we share

One sweet kiss took away my breath
Then you drew me in with your tenderness
You captivate my soul, I'm enraptured
You knocked me out and you locked me up
Stole my heart like a thief at love
Hold me tight in your happy ever after

Now you've got the best of me
No one else could hold the key
I'm captured

Just one touch took away my breath
When you drew me in I could not resist
You captivate my soul, I'm enraptured
You knocked me out and you locked me up
Stole my heart like a thief at love
Keep me here in your happy ever after
I'm captured
"
"""I Want To Be The One""",Christian Bautista,"""Captured""","

Don't wanna talk
Don't wanna drive
Don't wanna scream out loud
How do I make you mine
Don't wanna change your mind
Don't wanna know who's wrong or right
Don't wanna say goodnight
I'm no good with goodbye

So lets ignore the signs
That say were running out of time

I wanna be everything
More than you'll ever need
I know
I want to be the one
I would give anything
To be what you want me to be
I know
I want to be the one

Don't wanna sing
Don't wanna fight
Don't wanna go back home
I'm in no shape to drive
Don't wanna make you cry
Don't wanna leave us far behind
Don't wanna break up
To make up one more time

So lets ignore the signs
That say were running out of time

I wanna be everything
More than you'll ever need
I know
I want to be the one
I would give anything
To be what you want me to be
I know
I want to be the one

I don't wanna live without you
Don't even think I know how to
There must be a way to rewind
And start all over again!!!

I wanna be everything
More than you'll ever need
I know
I want to be the one
I would give anything
To be what you want me to be
I know
I want to be the one

Don't wanna talk
Don't wanna drive
Don't wanna say goodnight
I'm no good with goodbyes

I wanna be everything
More than you'll ever need
I know
I want to be the one
I would give anything
To be what you want me to be
I know
I want to be the one
"
"""Tell Me Your Name""",Christian Bautista,"""Romance Revisited: The Love Songs Of Jose Mari Chan""","

Tell me your name you're lovely
Please tell me your name
Just when I thought
This would be one of those boring games

You walked into these feelings
You looked at me and smiled
My heart unfroze and started going wild

Can you imagine this
The confusion of first loves kiss
A return to wondering
If the magic of love was this
You merely said hello
And my mind did a stop and go
Can it possibly be
The future for me is you... 
Tell me your name
I must know
Won't you tell me your name
I'm not insane
Just frightened that you might go
Don't go please stay beside me... 
Wait until I can tell you all my schemes
Chasing rainbows, spinning dreams
Finding someone to love like you... 

I'm not insane
Just frightened that you might go
Don't go please stay beside me
Just wait until
I can tell you all my schemes
Chasing rainbows, spinning dreams
Tell me please your name... 
Tell me...
"
"""I Remember The Girl""",Christian Bautista,"""Romance Revisited: The Love Songs Of Jose Mari Chan""","

Today I heard them play the song again
An old familiar strain from way back when
Every note and every line
It's always been a favorite song of mine
It used to haunt me so some years ago
Reminds me of a girl I used to know
And although the melody lives on
The memories and the girl are all but gone
And while the song still brings that certain glow
And the words still sing of love I know
It isn't quite the way it was before
I remember the girl
But I don't remember the feeling anymore

The promises we made seemed easier then
As if we knew our love would never end
But seasons change and time erases the tears
As quickly as the rivers disappear

So while the song still brings that certain glow
And the words still sing of love I know
It isn't quite the way it was before
I remember the girl
But I don't remember the feeling
I remember the girl
But I don't remember the feeling anymore
"
"""Afraid For Love To Fade""",Christian Bautista,"""Romance Revisited: The Love Songs Of Jose Mari Chan""","

My head's in a jam
Can't take you off my mind
From the time we met
I've been beset by thoughts of you
And the more that I ignore this feeling
The more I find my self believin'
That I just have to see you again

I can't let you pass me by
I just can't let you go
But I know that I'm much too shy to let you know
Afraid that I might say the wrong words and displease you
Afraid for love to fade
Before it can come true
Like a child again
I'm out and lost for words
How does one define a crush combined with longing
Longing to possess you, oh so dearly
And I'm obsessed by you completely
I'll go mad if I can't have you

I can't let you pass me by
I just can't let you go
But I know that I'm much too shy to let you know
Afraid that I might say the wrong words and displease you
Afraid for love to fade
Before it can come true

I can't let you pass me by
I just can't let you go
Let me say the things and say words to let you know
I would rather say the awkward words than lose you
Or for love to fade
Before it can come true...
"
"""I Have Fallen In Love""",Christian Bautista,"""Romance Revisited: The Love Songs Of Jose Mari Chan""","

I have fallen in love
with the same woman three times;
In a day spanning 19 years
of tearful joys and joyful tears.

I loved her first when she was young,
enchanting and vibrant, eternally new.
She was brilliant, fragrant,
and cool as the morning dew.

I fell in love with her the second time;
when first she bore her child and mine
always by my side, the source of my strength,
helping to turn the tide.

But there were candles to burn
the world was my concern;
while our home was her domain.
and the people were mine
while the children were hers to maintain;

So it was in those 18 years and a day.
till I was detained; forced in prison to stay.

Suddenly shes our sole support;
source of comfort,
our wellspring of Hope.
On her shoulders felt the burden of Life.

I fell in love again,
with the same woman the third time.
Looming from the battle,
her courage will never fade

Amidst the hardships she has remained,
undaunted and unafraid.
she is calm and composed,
she is Gods lovely maid.
"
"""Please Be Careful With My Heart""",Christian Bautista,"""Romance Revisited: The Love Songs Of Jose Mari Chan""","

[Sarah:]
If you love me like you tell me
Please be careful with my heart
You can take it just don't break it
Or my world will fall apart

[Sarah:]
You are my first romance
And I'm willing to take a chance
That 'till life is through
I'll still be loving you

[Sarah:]
I will be true to you
Just a promise from you will do
From the very start
Please be careful with my heart

[Christian:]
I love you and you know I do
There'll be no one else for me
Promise I'll be always true
For the world and all to see

[Christian:]
Love has heard some lies softly spoken
And I have had my heart badly broken
I've been burned and I've been hurt before

[Christian:] So I know just how you feel
[Sarah:] (how I feel)
[Christian:] Trust my love is real for you
[Sarah:] (I hope that you're love is real)
[Christian:] I'll be gentle with your heart
[Both:] I'll caress it like the morning dew

[Both:] I'll be right beside you forever
[Both:] I won't let our world fall apart
[Christian:] From the very start
[Christian:] I'll be careful with your heart

[Sarah:] You are my first (and you are my last) romance
[Sarah:] And I'm willing to take a chance
[Christian:] (I've learned from the past)
[Sarah:] That 'till life is through
[Both:] I'll still be loving you

[Sarah:] I will be true (I will be true) to you
[Sarah:] Just a promise from you will do (only to you)
[Sarah:] From the very start
[Christian:] (from the very start)
[Sarah:] From the very start
[Christian:] (from the very start)
[Sarah:] From the very start
[Sarah:] Please be careful with
[Christian:] (I'll be careful with)
[Both:] my heart (your heart)
"
"""My Girl My Woman My Friend""",Christian Bautista,"""Romance Revisited: The Love Songs Of Jose Mari Chan""","

When my work is through at the end of the day
There's nothing else that I'd rather do
Than to be with you at the end of the day
To be right by your side makes me feel brand new

'cause you're my girl, my woman, my friend
And that's how it's gonna be till the end.
Loving you is what I live for
And I can't ask for anything more
You're my woman, my girl, and my friend
Rolled into one.

You're my man and I'm at the prime of my life
To you I give myself, all my heart
All of what I am at the prime of my life
I'll never let a thing come to break us apart

'cause I'm your girl, your woman, your friend
And that's how it's gonna be till the end.
Loving you is what I live for
And I can't ask for anything more
Than to be your woman, your girl, and your friend.

Being with you, my love, just makes my day complete
Holding you close my love, creates a wondrous treat.
No need to say the words
No fancy places for me.
Love is anywhere
As long as you are there with me.
We'll be free.
Our love will make us free to be you and me.
"
"""Beautiful Girl""",Christian Bautista,"""Romance Revisited: The Love Songs Of Jose Mari Chan""","

Beautiful girl wherever you are
I knew when I saw you you had opened the door
I knew that I'd love again after a long long while
I'd love again
You said ""hello"" and I turned to go
But something in your eyes left my heart beating so
I just knew that I'd love again after a long long while
I'd love again

[Refrain:]
It was destiny's game
For when love finally came on
I rushed in line only to find
That you were gone

Wherever you are I fear that I might
Have lost you forever like a song in the night
Now that I've loved again after a long long while
I've loved again

[Repeat Refrain]

Beautiful girl I'll search on for you
'Til all of your loveliness in my arms come true
You've made me love again after a long long while
In love again
'And I'm glad that it's you
'Hmm beautiful girl
"
"""Can't We Start Over Again""",Christian Bautista,"""Romance Revisited: The Love Songs Of Jose Mari Chan""","

Its been a long, long while
I know Ive caused you pain
Living without you is not quite the same
Cant we start over again?

Ive played around too long
Running from end to end
Took you for granted
Ive been such a fool
Cant we start over again?

All through my life of seasons
No matter how far I roam
Always theres something missing inside
Yearning to come back home

You are the one I return to
Love. Only love leads the way
Give us this chance to start over again
Darling, Im coming home to stay
"
"""Be Gentle""",Christian Bautista,"""Romance Revisited: The Love Songs Of Jose Mari Chan""","

Be gentle, be gentle,
And all the world is yours
A river flowing home to sea
You shall be.

Be strong and know your heart
Protect the small, the weak,
And love like morning rain shall fall
On a song.

There is no peace
In an angry heart
The wise know the truth
There is no power stronger
Than gentleness of heart.

Beneath, the waters and the rock will turn the sand
It took a wounded man to show the world
That if we want to live
We must forgive

Oh, Lord the night is long,
The dawn cannot be far
When gentle winds of peace
Fill every heart.

A river flowing home to sea,
I shall be.
"
"""Stay My Love""",Christian Bautista,"""Romance Revisited: The Love Songs Of Jose Mari Chan""","

My heart is hurting and its all because of you
What can I do to make you want to stay
I like to know you more each past and day
Lets sees the moment love will crush our way

I never try to keep a love on hold before
Love easy came was meant but there are more
I was so shallow reckless cold and sure
But you are to give me love secure

Be my love and love me in the sweetness of you being
Stay my love and we become the music in the ecstasy
Lets make the world a wonderland make believe
Lets us become the river of this magic
So stay and save me from this restless night
And see me trough the dark
I love you

My life will never ever be the same again
The love is gone, my turn to feel the pain
You are the one I've been waiting for
You are the one I'll cherish like a doll

Be my love and love me in the sweetness of you being
Stay my love and we become the music in the ecstasy
Lets make the world a wonderland make believe
Lets us become the river of this magic
So stay and save me from this restless night
And see me trough the dark

Lets make the world a wonderland make believe
Lets us become the river of this magic
So stay and save me from this restless night
And see me trough the dark

I'll give you all my love
Stay my love
"
"""Afterglow""",Christian Bautista,"""Romance Revisited: The Love Songs Of Jose Mari Chan""","

We're at the afterglow
Of what we both do know
As the spring of our youth.
We've loved and shared the dawn
And hoped that we'd go on
'Cause even the dawn had to go.

Love has to cry
But need not die
Heart has to sigh
The test of time

We go through days and through years
Calloused by doubts, joys and fears,

Love has to cry
But need not die
Heart has to sigh
The test of time

We're at the afterglow
and though we both do know
how far we are from the dawn
That second golden dawn
When love is true
Still I'll wait
I'll wait for second dawn and you

Love's golden dawn and you.
"
"""A Love To Last A Lifetime""",Christian Bautista,"""Romance Revisited: The Love Songs Of Jose Mari Chan""","

We're all just merely passing through
Doing what we can do in our lifetime
We have more than one adventure to take
More than one dream to make in our lifetime
As for me there's only one dream
And that's to love you my love
With a love to last a lifetime

We're fools we'd sometimes do crazy things
And our hearts would take wins like a sparrow
But that's life
We'll take each day as it comes
Never leaving the crumbs for the morrow
As for me, all of my days I will spend them all with you
Loving you with love to last a lifetime

If we all could leave something lasting behind to be remembered by
Just a song for me and then at least I would have tried
I agree it's not so much what we have
As how we use what we have in our lifetime

Thirty years is worth a hundred and two
It's really what we can do in our lifetime
All my love I would give for as long as I may live
With a love, true love, to last a lifetime
"
"""Here And Now""",Christian Bautista,"""Romance Revisited: The Love Songs Of Jose Mari Chan""","

You and I may never be the perfect pair
The kind most people dream
Themselves to be
Just as long as you and I
Are both aware
That life is what we make it to be
Then we won't care what others
Have to say
Our love will guide us
And show the way, oh baby

[Refrain:]
From this moment on it's
Me and you
The road of life ahead we'll journey
Through
And through it may be winding
We'll go right on reminding
That we both have each other

[Chorus:]
Cherish every moment
Darlin' hold me fast
Live each day as though it
Were last
The only time and place that
We are certain of
My love, is here and now

We had yesterday but now it's
Come and gone
Tomorrow still to come belongs to none
We had found the miracle of love today
If we try hard enough it's here to stay
Our rainbows end may just be rond the bend
I know we'll find it but until the oh baby

[repeat refrain and chorus]
[repeat chorus]
"
"""Constant Change""",Christian Bautista,"""Romance Revisited: The Love Songs Of Jose Mari Chan""","

We're on the road
We move from place to place
And oftentimes when I'm about to call it home
We'd have to move along
Life is a constant change

The friends we know we meet along the way
Too soon the times we share form part of yesterday
'Cause life's a constant change
And nothing stays the same, oh no

Clouds that move across the skies
Are changing form before our very eyes

Why couldn't we keep time from movin' on?
Hold on to all the years before this moment's gone?
Why must we live the days at such a frightening pace?

We're all like clouds that move across the skies
And changing form before our very eyes

Have we outgrown our Peter Pans and wings?
We've simply grown too old for tales of knights and kings
'Cause life's a constant change
And nothing stays the same, oh no
"
"""Deep In My Heart""",Christian Bautista,"""Romance Revisited: The Love Songs Of Jose Mari Chan""","

Deep in my Heart I love you 
Deep in my heart I care 
You are my life 
My every faith, my dream, my every prayer 

Deep in my heart I know
That deep in your heart you know 
That we where meant for each other 
And we will love each other forever 

Deep in my heart I know
That deep in your heart you know 
That we were meant for each other 

And deep within my heart 
And deep in your heart 
Yes we will love each other forever
Deep in my heart forever
"
"""Refrain""",Christian Bautista,"""Romance Revisited: The Love Songs Of Jose Mari Chan""","

I look out and I see the rain
As it falls on my window pane
And the music that's in my heart
Is a sad refrain

Endless traffic of sounds and sights
Midst the glitter of neon lights
Still the music that's in my heart
Is the same sad refrain

Mem'ries of you follow everywhere I go
Down the high and bi-ways of my days
Music of your laughter fills my every dream
Like a love song, from long ago
Never ending streams of faces come and go
Million diff'rent people all around
No use searching for I'll never find you there
For you are far beyond compare

Take a jet to a hi-away
From the hum-drum of everyday
Yet the music that's in my heart
Is the same sad refrain

Mem'ries of you follow everywhere I go
Down the high and bi-ways of my days
Music of your laughter fills my every dream
Like a love song, from long ago

Never ending streams of faces come and go
Million diff'rent people all around
No use searching for I'll never find you there
For you are far beyond compare

No use searching for I'll never... 
No use searching for I'll never find you there
For you are far beyond compare...
"
"""Can We Just Stop And Talk A While""",Christian Bautista,"""Romance Revisited: The Love Songs Of Jose Mari Chan""","

Fancy meeting you alone in the crowd
Couldnt help but notice your smile
While everybody else around us is going about
Can we just stop and talk awhile?

Ive been often told our worlds growing old
And that friends are harder to find
Do tell me more about yourself
We could share a thought or two
Now who would mind?

Maybe then we could go for a ride
Drive down to the countryside
Get away from the gray
And frenzied hurly-burly of the city life

Early yet to say what lies ahead
Its the first day of the rest of our lives
Can we just stop and talk awhile
Get to know each other
Who are we to know?
Love could be waiting at the end
Round that bend and so
Lets stop and talk awhile

Can we just stop and talk awhile
Get to know each other
Who are we to know?
Love could be waiting at the end
Round that bend and so
Lets stop and talk awhile
Lets stop and talk awhile
Lets stop and talk awhile
Lets stop and talk awhile
"
"""All That's Left""",Christian Bautista,"""Outbound""","

All that's left, all that's left
All that's left of me
All that's left, all that's left
All that's left of me

You know I'm not alright
Cause all that I've been through
Has left me cold inside
And feelin' like a fool
But even when I don't say a word
Somehow you understand

Cause I've been hurt before
And healin' takes so long
Trust shattered on the floor
Pretending to be strong
But girl you picked up the pieces
And showed me just how you belong
So I must sing this song

You're the best thing that has ever happened to me
Thought I'd locked my heart but you found the key
You bring out the best in whatever's left of me
All that's left of me

All that's left, all that's left
All that's left of me

I'd given up the fight
My heart would never mend
I couldn't see the light
Or find the tunnel's end
Thought I would never feel it again
And then I met you

You made me realize
What loving's all about
Building each other's lives
Casting aside all doubt
So I take this leap of faith
Cause I can't imagine life without you

You're the best thing that has ever happened to me
Thought I'd locked my heart but you found the key
And when it's all done, holding you in my arms
Feels just how it should be

Your eyes take me off to a special space
With you everything seems to fall into place
You bring out the best in whatever's left of me
All that's left of me... left of me
You bring out the best in whatever's left of me

You're the best thing that has ever happened to me
Thought I'd locked my heart but you found the key
And when it's all done, holding you in my arms
Feels just how it should be

Your eyes take me off to a special space
With you everything seems to fall into place
You bring out the best in whatever's left of me
All that's left of me...
All that's left of me...

All that's left
All that's left
All that's left of me
"
"""Faith""",Christian Bautista,"""Outbound""","

Well I guess it would be nice
If I could touch your body
I know not everybody
Has got a body like you, mmm

But I've got to think twice
Before I give my heart away
And I know all the games you play
Because I play them too

Oh, but I
Need some time off from that emotion
Time to pick my heart up off the floor
And when that love comes down
Without devotion
Well it takes a strong man baby
But I'm showing you the door

Cause I gotta have faith
I gotta have faith
Yes I gotta have faith-a-faith-a-faith
I gotta have faith-a-faith-a-faith

Baby
I know you're asking me to stay
Say please, please, please don't go away
You say I'm giving you the blues
Maybe
You mean every word you say
Can't help but think of yesterday
And another who tied me down to loverboy rules

Before this river
Becomes an ocean
Before you throw my heart back on the floor
Oh baby I reconsider
My foolish notion
Well I need someone to hold me
But I'll wait for something more

Cause I've gotta have faith
I gotta have faith
Yes I gotta have faith-a-faith-a-faith
I gotta have faith-a-faith-a-faith

Before this river
Becomes an ocean
Before you throw my heart back on the floor
Oh baby I reconsider
My foolish notion
Well I need someone to hold me
But I'll wait for something more

Cause I gotta have faith
I gotta have faith
Yes I got to have faith-a-faith-a-faith
I gotta have faith-a-faith-a-faith
"
