Song,Artist,Album,Lyrics
"""Will He Like Me / Vanilla Ice Cream / Till There Was You""",Lea Salonga,"""Live In Concert With The Sydney Symphony Orchestra""","

Will he like me when we meet?
Will the shy and quiet girl he's going to see
Be the girl that he's imagined me to be?
Will he like me?

Will he like the girl he sees?
If he doesn't, will he know enough to know
That there's more to me than I may always show?
Will he like me?

Will he know that there's a world of love
Waiting to warm him?
How I'm hoping that his eyes and ears
Won't misinform him

Will he like me? Who can say?
How I wish that we could meet another day
It's absurd for me to carry on this way
I'll try not to
Will he like me?
He's just got to

When I am in my room alone and I write
Thoughts come easily, words come fluently then
That's how it is when I'm alone, but tonight
There's no hiding behind my paper and pen

Will he know that there's a world of love
Waiting to warm him?
How I'm hoping that his eyes and ears
Won't misinform him

Will he like me? I don't know
All I know is that I'm tempted not to go
It's insanity for me to worry so
I'll try not to

Will he like me?
He's just got to
Will he like me?

Ice cream
He brought me ice cream!
Vanilla ice cream
Imagine that
Ice cream
And for the first time
We were together
And that was that
Friendly
I got so friendly
That isn't like me
And I was stunned

Will wonders never cease?
Will wonders never cease?
It's been a most fantastic day
And strange as it may seem
My life is like a dream
Because he offered me
Vanilla ice cream

There were bells on a hill
But I never heard them ringing
No, I never heard them at all
Till there was you

There were birds in the sky
But I never saw them winging
No, I never saw them at all
Till there was you

And there was music
And there were wonderful roses
They tell me in sweet fragrant meadows
Of dawn and dew

There was love all around
But I never heard it singing
No, I never heard it at all
Till there was you
"
"""Journey To The Past""",Lea Salonga,"""Live In Concert With The Sydney Symphony Orchestra""","

Heart don't fail me now
courage don't desert me
don't turn back now that we're here
people always say 
life is full of choices
no one ever mentions fear
or how the world can seem so vast
on a journey to the past

somewhere down this road
I know someone's waiting
years of dreams just can't be wrong
arms will open wide
I'll be safe and wanted
finally home where I belong
well, starting now, i'm learning fast
on this journey to the past

home, love, family
there was once a time I must have had them too
home, love, family
I will never be complete until I find you

one step at a time
one hope then another
who knows where this road may go?
back to who I was
on to find my future
things my heart still needs to know

yes, let this be a sign
let this road be mine
let it lead me to my past
to bring me home at last

let this be a sign
let this road be mine
let it lead me to my past
and bring me home... at last
"
"""Why God Why?""",Lea Salonga,"""Live In Concert With The Sydney Symphony Orchestra""","

Why does Saigon never sleep at night?
Why does this girl smell of orange trees?
How can I feel good when nothing's right?
Why is she cool when there is no breeze?
Vietnam, you don't give answers, do you friend?
Just questions that don't ever end

Why, God, why today?
I'm all through here, on my way
There's nothing left here that I'll miss
Why send me now, a night like this?

Who is the girl in this rusty bed?
Why am I back in a filthy room?
Why is her voice ringing in my head?
Why am I high on her cheap perfume?
Vietnam, hey look, I mean you no offense
But why does nothing here make sense?

Why, God? show your hand
Why can't one guy understand
I've been with girls who knew much more
I never felt confused before

Why me, what's your plan?
I can't help her, no one can
I liked my memories as they were
But now I'll leave remembering her

When I went home before
No one talked of the war
What they knew from TV
Didn't have a thing to do with me
I went back and re-upped
Sure Saigon is corrupt
It felt better to be here
Driving for the embassy

'Cause here if you can pull a string
A guy like me lives like a king
Just as long as you don't believe anything

Why, God, why this face?
Why such beauty in this place?
I liked my memories as they were
But now I'll leave remembering her
Just her
"
"""Meadowlark""",Lea Salonga,"""Live In Concert With The Sydney Symphony Orchestra""","

When I was a girl, I had a favorite story
Of a meadowlark who lived where the rivers wind
Her voice could match the angels in its glory
But she was blind, the lark was blind

An old king came and took her to his palace
Where the walls were burnished bronze and golden braid
And he fed her fruit and nuts from an ivory chalice
And he prayed:

Sing for me, my meadowlark
Sing for me of the silver morning
Set me free, my meadowlark
And I'll buy you a previous jewel
And cloth of brocade and cruel
And I'll love you for life
If you will sing for me

Then one day as the lark sang by the water
The god of the sun heard her in his flight
And her singing moved him so, he came and brought her
The gift of sight, he gave her sight

And she opened her eyes to the shimmer and the splendor
Of this beautiful young god, so proud and strong
And he called to the lark in a voice both rough and tender:
Come along

Fly with me, my meadowlark
Fly with me on the silver morning
Past the sea where the dolphins bark
We will dance on the coral beaches
Make a feast of the plums and peaches
Just as far as your vision reaches
Fly with me

But the meadowlark said no
For the old king loved her so
She couldn't bear to wound his pride
So the sun god flew away
And when the king came down that day
He found his meadowlark had died
Every time I heard that part I cried

And now I stand here, starry-eyed and stormy
Oh, just when I thought my heart was finally numb
A beautiful young man appears before me
Singing, ""Come, oh won't you come?""

And what can I do if finally for the first time
The one I'm burning for returns the glow
If love has come at last it's picked the worst time
Still I know I've got to go

Fly away, meadowlark
Fly away in the silver morning
If I stay, I'll grow to curse the dark
So it's off where the days won't bind me
I know, I leave wounds behind me
But I won't let tomorrow find me
Back this way

Before my past once again
Can blind me, fly away
And we won't wait to say goodbye
My beautiful young man and I
"
"""Children Will Listen""",Lea Salonga,"""Live In Concert With The Sydney Symphony Orchestra""","

How do you say to your child in the night
""Nothing's all black, but then nothing's all white""?
How do you say ""It will all be alright""
When you know that it might not be true, what do you do?

Careful the things you say
Children will listen
Careful the things you do
Children will see and learn
Children may not obey
But, children will listen
Children will look to you
For which way to turn
To learn what to be
Careful before you say
""Listen to me""
Children will listen

Careful the wish you make
Wishes are children
Careful the path they take
Wishes come true, not free
Careful the spell you cast
Not just on children
Sometimes the spell may last
Past what you can see
And turn against you
Careful the tale you tell
That is the spell
Children will listen

How can you say to a child who's in flight
""Don't slip away and I won't hold so tight""?
What can you say that no matter how slight
Won't be misunderstood?
What do you leave to your child when you're dead?
Only whatever you put in it's head
Things which your mother and father which were left to them too

Careful what you say
Children will listen
Careful you do it to
Children will see and learn
Guide them but step away
Children will glisten
Temper with what is true
And children will turn
If just to be free
Careful before you say
""Listen to me""
Children will listen
Children will listen

Children
Children will listen
"
"""Drops Of Jupiter""",Lea Salonga,"""Live In Concert With The Sydney Symphony Orchestra""","

Now that she's back in the atmosphere
With drops of Jupiter in her hair
She acts like summer and walks like rain
Reminds me that there's a time to change
Since the return of her stay on the moon
She listens like spring and she talks like June

Tell me, did you sail across the sun?
Did you make it to the Milky Way
To see the lights all faded
And that heaven is overrated?
Tell me, did you fall from a shooting star?
One without a permanent scar
And did you miss me while you were
Looking for yourself out there?

Now that she's back from that soul vacation
Tracing her way through the constellation
She checks out Mozart while she does Tae-Bo
Reminds me that there's room to grow
Now that she's back in the atmosphere
I'm afraid that she might think of me as
Plain old Jane told a story about a man
Who was too afraid to fly so he never did land

Tell me, did the wind sweep you off your feet?
Did you finally get the chance
To dance along the light of day
And head back to the Milky Way?
Tell me, did Venus blow your mind?
Was it everything you wanted to find?
And did you miss me while you were
Looking for yourself out there?

Can you imagine no love, pride, deep-fried chicken
Your best friend always sticking up for you
Even when I know you're wrong?
Can you imagine no first dance, freeze-dried romance
Five-hour phone conversation
The best soy latte that you ever had, and me?

But tell me, did the wind sweep you off your feet?
Did you finally get the chance
To dance along the light of day
And head back to the Milky Way?
But tell me, did you sail across the sun?
Did you make it to the Milky Way
To see the lights all faded
And that heaven is overrated?
Tell me, did you fall for a shooting star?
One without a permanent scar
And did you miss me while you were
Looking for yourself?

Na, na, na, na, na, na
Na, na, na, na, na, na
And did you finally get the chance
To dance along the light of day?
Na, na, na, na, na, na
Na, na, na, na, na, na
And did you fall for a shooting star?
Fall for a shooting star?
Na, na, na, na, na, na
Na, na, na, na, na, na
And are you lonely looking for yourself out there?
"
"""Will You Love Me Tomorrow?""",Lea Salonga,"""Live In Concert With The Sydney Symphony Orchestra""","

Tonight you're mine completely
You give your love so sweetly
Tonight the light of love is in your eyes
But will you love me tomorrow?

Is this a lasting treasure
Or just a moment's pleasure?
Can I believe the magic of your sighs?
Will you still love me tomorrow?

Tonight with words unspoken
You said that I'm the only one
But will my heart be broken
When the night meets the morning sun?

I'd like to know that your love
Is love I can be sure of
So tell me now, and I won't ask again
Will you still love me tomorrow?
Will you still love me tomorrow?
Will you still love me tomorrow?
"
"""A Whole New World""",Lea Salonga,"""Live In Concert With The Sydney Symphony Orchestra""","

I can show you the world
Shining, shimmering, splendid
Tell me, princess
Now when did you last let your heart decide?
And I can open your eyes
Take you wonder by wonder
Over, sideways and under
On a magic carpet ride

A whole new world
A new fantastic point of view
No one to tell us no or where to go
Or say we're only dreaming
A whole new world
A dazzling place I never knew
But when I'm way up here, it's crystal clear
That now, I'm in a whole new world with you
Now I'm in a whole new world with you

Unbelievable sights
Indescribable feeling
Soaring, tumbling, freewheeling
Through an endless diamond sky
A whole new world (don't you dare close your eyes)
A hundred thousand things to see (hold your breath, it gets better)
I'm like a shooting star, I've come so far
I can't go back to where I used to be

A whole new world (every turn a surprise)
With new horizons to pursue (every moment red-letter)
I'll chase them anywhere, there's time to spare
Let me share this whole new world with you

A whole new world (a whole new world)
That's where we'll be (that's where we'll be)
A thrilling chase (a wondrous place)
For you and me
"
"""This Is Me""",Lea Salonga,"""Live In Concert With The Sydney Symphony Orchestra""","

I'm not a stranger to the dark
Hide away, they say
'Cause we don't want your broken parts
I've learned to be ashamed of all my scars
Run away, they say
No one will love you as you are, but

But I won't let them break me down to dust
I know that there's a place for us
For we are glorious

When the sharpest words wanna cut me down (hey, hey, hey)
Gonna send a flood, gonna drown 'em out (hey, hey, hey)
I am brave, I am bruised
I am who I'm meant to be, this is me
Look out 'cause here I come
And I'm marching on to the beat I drum
I'm not scared to be seen
I make no apologies, this is me

Another round of bullets hits my skin (hey)
Well, fire away (whoa) 'cause today (oh), I won't let the shame sink in (yeah, yeah, yeah)
We are bursting (oh) through the barricades (oh-whoa)
And reaching for the sun (we are warriors)
Yeah, that's what we've become
Yeah, that's what we've become

I won't let them break me down to dust
I know that there's a place for us
For we are glorious

When the sharpest words wanna cut me down (hey, hey, hey)
Gonna send a flood, gonna drown 'em out (hey, hey, hey)
I am brave, I am bruised
I am who I'm meant to be, this is me

And I know that I deserve your love
There's nothing I'm not worthy of

When the sharpest words wanna cut me down
I'm gonna send a flood, gonna drown them out
This is brave, this is bruised
This is who I'm meant to be, this is me

Look out 'cause here I come (look out 'cause here I come)
And I'm marching onto the beat I drum (marching on, marching, marching on)
(I'm not scared to be seen, I make no apologies) this is me
(Whenever the words wanna cut me down
I'll send the flood to drown them out)
I'm gonna send the flood, I'm gonna drown them out, yeah, yeah
This is me
"
"""On My Own""",Lea Salonga,"""Live In Concert With The Sydney Symphony Orchestra""","

And now I'm all alone again
Nowhere to turn, no one to go to.
Without a home, without a friend
without a face to say hello to
But now the night is near 
And I can make-believe he's here

Sometimes I walk alone at night
When everybody else is sleeping
I think of him and then I'm happy
With the company I'm keeping
The city goes to bed
And I can live inside my head

On my own
Pretending he's beside me
All alone
I walk with him 'til morning
Without him, I feel his arms around me
And when I lose my way, I close my eyes and he has found me

In the rain
The pavement shines like silver
All the lights are misty in the river
In the darkness, the trees are full of starlight
And all I see is him and me forever and forever

And I know it's only in my mind
That I'm talking to myself and not to him
And although I know that he is blind
Still I say there's a way for us

I love him
But when the night is over
He is gone
The river's just a river
Without him, the world around me changes
The trees are bare and everywhere the streets are full of strangers

I love him
But every day I'm learning
All my life I've only been pretending
Without me, his world will go on turning
A world that's full of happiness that I have never known

I love him
I love him
I love him...
But only on my own...
"
"""Boy Band Medley""",Lea Salonga,"""Live In Concert With The Sydney Symphony Orchestra""","

[Back for Good:]
I guess now it's time for me to give up, I feel it's time
Got a picture of you beside me, got your lipstick mark still on your coffee cup, ah yeah
Got a fist of pure emotion, got a head of shattered dreams
Gotta leave it, gotta leave it all behind now

Whatever I said, whatever I did, I didn't mean it
I just want you back for good
(Want you back, want you back, want you back for good)
Whenever I'm wrong, just tell me the song, and I'll sing it
You'll be right and understood
(Want you back, want you back, want you back for good)
I want you back for good

I guess now it's time, that you came back for good

[MMMBop:]
You have so many relationships in this life
Only one or two will last
You're going through all the pain and strife
Then you turn your back and they're gone so fast, oh yeah
And they're gone so fast, yeah, yeah

Mmm bop, ba duba dop
Ba du bop, ba duba dop
Ba du bop, ba duba dop
Ba du
Mmm bop, ba duba dop
Ba du bop, ba du dop
Ba du bop, ba du dop
Ba du, oh
Mmm bop

[Tearin' Up My Hear:]
It's tearing up my heart when I'm with you
But when we are apart, I feel it too
And no matter what I do, I feel the pain
With or without you

Baby I don't understand
Why we can't be lovers
Things are getting out of hand
Trying too much but baby we can win

Let it go
If you want me, girl, let me know
I am down on my knees
I can't take it anymore

It's tearing up my heart when I'm with you
But when we are apart, I feel it too
And no matter what I do, I feel the pain
With or without you

[I Want It That Way:]
You are my fire
The one desire
Believe when I say
I want it that way

Tell me why
Ain't nothing but a heartache
Tell me why
Ain't nothing but a mistake
Tell me why
I never wanna hear you say
I want it that way
'Cause I want it that way

[My Love:]
An empty street, an empty house
A hole inside my heart
I'm all alone, the rooms are getting smaller
I wonder how, I wonder why
I wonder where they are
The days we had, the songs we sang together

And all my love, I'm holding on forever
Reaching for the love that seems so far

So I say a little prayer
And hope my dreams will take me there
Where the skies are blue to see you once again, my love
Over seas from coast to coast
To find the place I love the most
Where the fields are green to see you once again, my love

[What Makes You Beautiful:]
You're insecure, don't know what for
You're turning heads when you walk through the door
Don't need makeup to cover up
Being the way that you are is enough

Everyone else in the room can see it
Everyone else but you

Baby, you light up my world like nobody else
The way that you flip your hair gets me overwhelmed
But when you smile at the ground, it ain't hard to tell
You don't know, oh-oh
You don't know you're beautiful
If only you saw what I can see
You'll understand why I want you so desperately
Right now I'm looking at you and I can't believe
You don't know, oh-oh
You don't know you're beautiful, oh-oh
You don't know you're beautiful, oh-oh
That's what makes you beautiful
"
"""A Dream Is A Wish Your Heart Makes""",Lea Salonga,No Album,"

A dream is wish your heart makes
When you're fast asleep
In dreams, you will lose your heartache
Whatever you wished for, you keep

Have faith in your dream and someday
Your rainbow will come smiling too
No matter how your heart is grieving
If you keep on believing
The dream that you wish will come true

La la la la la la la la la la la rin
Ohh oh la ra la ra la rin
Ohh oh la ra la ra la rin

No matter how your heart is grieving
If you keep on believing
The dream tha you wish will come true

No matter how your heart is grieving
If you keep on believing
The dream tha you wish will come true
"
"""A Hundred Million Miracles""",Lea Salonga,No Album,"

My father says
That children keep growing
Rivers keep flowing too
My father says
He doesn't know why
But somehow or other they do
They do
Some how or other they do

A hundred million miracles
A hundred million miracles
Are happ'ning ev'ry day
And those who say
They don't agree
Are those
Who do not hear or see
A hundred million miracles
A hundred million miracles
Are happ'ning ev'ry day

Miracle of changing weather
When a dark blue curtain
Is pinned by the stars
Pinned by the stars to the sky
Ev'ry flow'r
And tree is a treat to see
The air is very clean and dry

Then a wind comes blowing
The pins all away
Night is confused and upset
The sky falls down
Like a clumsy clown
The flowers
And the trees get wet
Very wet

A hundred million miracles
A hundred million miracles
Are happ'ning ev'ry day
And when the wind
Shall turn his face
The pins
Are put right back in place
A hundred million miracles
A hundred million miracles
Are happ'ning ev'ry day

In ev'ry single minute
So much is going on
Along the Yangtse Kiang
Or the Tiber or the Don
A hundred million miracles

A swallow in Tasmania
Is sitting on her eggs
And suddenly
Those eggs have wings
And eyes and beaks and legs
A hundred million miracles

A little girl in Chungking
Just thirty inches tal
Decides that she
Will try to walk
And nearly doesn't fall
A hundred million miracles

A hundred million miracles
A hundred million miracles
A hundred million miracles
Are happ'ning ev'ry day

My father says the sun
Will keep rising over
The eastern hill
My father says
He doesn't know
Why but somehow
Or other it will
It will
Somehow or other it will

Miracle of making music
When an idle poet
Puts words on a page
Writes on a page
With his brush
A musical friend
Writes the notes to blend
Suggested
By an idle thrush

Then a young soprano
Reads what they wrote
Learns every note
Every word
Puts all they wrote
In her lovely throat
And suddenly
A song is heard
Very pretty

A hundred million miracles
A hundred million miracles
A hundred million miracles
Are happ'ning ev'ry day
"
"""A Little Fall Of Rain""",Lea Salonga,No Album,"

Don't you fret, Monsieur Marius,
I don't feel any pain.
A little fall of rain
Can hardly hurt me now.
You're here, that's all I need to know.
And you will keep me safe,
And you will keep me close,
And rain will make the flowers grow.

But you will live, 'Ponine,
Dear God above!
If I could heal your wounds with words of love!

Just hold me now, and let it be,
Shelter me, 
Comfort me...

You would live a hundred years 
If I could show you how. 
I won't desert you now.

The rain can't hurt me now. 
This rain will wash away what's past! 
And you will keep me safe, 
And you will keep me close, 
I'll sleep in your embrace at last! 
The rain that brings you here is heaven-blessed!
The skies begin to clear and I'm at rest. 
A breath away from where you are, 
I've come home from so far...

So don't you fret, Monsieur Marius,
I don't feel any pain.
A little fall of rain
Can hardly hurt me now.

Hush-a-bye, dear Eponine,
You won't feel any pain.
A little fall of rain
Can hardly hurt you now.

I'm here,

That's all I need to know.

And you will keep me safe,
And you will keep me close,

I will stay with you, 
'Til you are sleeping...

And rain,

And rain,

Will make the flowers...

Will make the flowers...grow.
"
"""Bayaning Tunay""",Lea Salonga,"""Songs From Home""","

[Gary V:]
Bawat araw ay may digmaan
Di mo man lang nakikita ang kalaban

[RVA:]
Balot na balot sa panablang saplot
Halos walang pahinga

[ZZP:]
At kagipita'y hindi nila iniinda
[POPS:]
Di man lang makapiling ang pamilya
[Erik:]
Ang maglingkod ang kanilang isinumpa
[Angeline:]
Kahit buhay pa nila ang nakataya

[Sam C:]
Kailangan na sila ay tulungan
[KZ:]
Hindi natin sila dapat kalimutan
[Lea:]
Sino pa ba kundi tayo-tayo rin
Ang kikilos para sa bayan natin

[Martin:]
Saludo, saludo
Sa inyong kabayanihan
[Ogie:]
Salamat, salamat
Sa inyong pagmamalasakit
[Piolo:]
Mahal namin kayo, ng taos puso
[Martin / Ogie / Piolo:]
Bayaning tunay kayo

[Bamboo:]
Saludo, saludo
Sa inyong kabayanihan
[Ely:]
Salamat, salamat
Sa inyong pagmamalasakit
[Rico:]
Mahal namin kayo, ng taos puso
Bayaning Tunay kayo

[Lani:]
Kayrami ng mga nasawi
Sa puso natin sila'y Mananatili
[Morissette:]
Hindi sa ganito matatapos ito
[Janine:]
Magsama-sama na tayo

[Christian B / Kyla:]
Saludo, saludo
Sa inyong kabayanihan
[Jed and Klarisse:]
Salamat, salamat
Sa inyong pagmamalasakit
[Jason Dy / Noel C / Nyoy:]
Mahal namin kayo, ng taos puso
Bayaning tunay kayo

[All (with aria by Lara Maigue):]
Saludo, saludo
Sa inyong kabayanihan
Salamat, salamat
Sa inyong pagmamalasakit
Mahal namin kayo, ng taos puso
Bayaning tunay kayo
Bayaning tunay kayo
"
"""Chiquitita""",Lea Salonga,No Album,"

Chiquitita, tell me what's wrong
You're enchained by your own sorrow
In your eyes, there is no hope for tomorrow

How I hate to see you like this
There is no way you can deny it
I can see that you're oh, so sad, so quiet

Chiquitita, tell me the truth
I'm a shoulder you can cry on
Your best friend, I'm the one you must rely on
You were always sure of yourself
Now I see you're broken and fed up
I hope we can patch it up together

[Refrain:]
Chiquitita, you and I know
How the heartaches come and they go
And the scars, they're leavin'
You'll be dancin' once again
And the pain will end

You will have no time for grievin'
Chiquitita, you and I cried
But the sun is still in the sky
And shining above you
Let me hear you sing once more
Like you did before
Sing a new song, chiquitita
Try once more, like you did before
Sing a new song, chiquitita

So the walls came tumblin' down
And your love's turned lonely and dreadful
All is gone and it seems too hard forever

Chiquitita tell me the truth
There is no way you can deny it
All I see that you're, oh so sad, so quiet

[repeat refrain]

[Coda:]
Try once more, like you did before
Sing a new song, chiquitita
"
"""Cosmic Rescue""",Lea Salonga,No Album,"

kagayaki ga afureru basho sagasou
tsuraku tatte koeteikeba hoshi ga mieru
itsuka kitto yume wa kanau hazu
akiramenai de kiseki sae okosou

Shooting Star ikusen mono hikari wa
sorezore no kotoba de yozora o terashiteiku
Shooting Star bokura no kanousei wa
ano hoshi no mugen sae karuku koeru hazu da yo

tachidomatte sukoshi naita koto mo
kimi ni totte daiji na hazu sugu ni wakaru
kanashikatta kyou no namida sae
waraechau kurai natsukashiku naru kara

Shooting Star ikusen mono hikari wa
sorezore no kiseki de yozora o egaiteiku
Shooting Star shiawase ni todokeba
furikaeru jikan sae kagayakaseru hazu da yo

Shooting Star ikusen mono hikari wa
sorezore no negai o michibiku you ni kagayaku
Shooting Star bokura no kanousei wa
ano hoshi no mugen sae karuku koeru hazu da yo
Shooting Star ima nagareru hoshi ga
sagashiteta mirai sae terashitekureru hazu sa
"
