Song,Artist,Album,Lyrics
"""I'm Already King""",Christian Bautista,"""Outbound""","

This is the time
I have to believe
No one can take my faith away

And I'm flying through the night
Flying to the sky
And go higher and higher again
And go higher and higher again

I'm already king
In my own empire
I'm already here
I've already reached my desires
Uh no one can take my dreams away

And I'm flying through the night
Flying to the sky
And go higher and higher again
And go higher and higher again

I'm already king yeah
I'm already king

And I'm flying through the night
Flying to the sky
And go higher and higher again
And go higher and higher again

And I'm flying through the night
Flying to the sky
And go higher and higher again
And go higher and higher again

I'm already king
In my own empire
I'm already here
I've already reached my desires
Cause I'm with you
"
"""What Can I Do""",Christian Bautista,"""Outbound""","

I'm sorry if every song I sing is for you
Sorry if my whole world revolves around you
When I look at you
I find all my answers

I'm sorry if I hang on every word you say
Sorry if I think about you everyday
When I hear your voice
There's no need for tears

What can I do
To make you heart hear
To silence all your fears
Don't close your soul on me don't sell our memory
Oh you alone can save me
Oh you alone set me free
There's nothing else I wanna do
I'm so in love with you

How make you heart hear
I'll silence all your fear
Don't close you soul on me
Drown me in your love again and again
I am so in love with you

I'm sorry if I'm still holding both your hands
Sorry if I can't forget all that we've planned
I know you said no
But I won't let go

What can I do
To make your heart hear
To silence all your fear
Don't close your soul on me don't sell our memory
Oh you alone can save me
Oh you alone set me free
There's nothing else I wanna do
I'm so in love with you

How make your heart here
I'll silence all your fear
Don't close your soul on me
Drown me in your love again and again
I am so in love with you

Don't close your soul on me don't sell our memory
Oh you alone can save me
Oh you alone set me free
There's nothing else I wanna do
I'm so in love with you

I'll make your heart here
I'll silence all your fear
Don't close your soul on me
Drown me in your love again and again
I am so in love with you
"
"""Never Far Away""",Christian Bautista,"""Outbound""","

Another mile down the road
Another mile from my home
At times I feel quite alone
Cause you know, cause you know all there is to know
So hold my heart, as it's breaking apart
And I'll, I'll hold yours in mine

Oh oh oh oh, you're never far away
Oh oh oh oh, you're never far away
Oh oh oh oh, you're never far away
From me

I close my eyes and try to see
See you right in front of me
As if you're only in my dreams
But you are everywhere and in between
You're the moonlight in the dark of my night
And you shine bright so I can see

Oh oh oh oh, you're never far away
Oh oh oh oh, you're never far away
Oh oh oh oh, you're never far away
From me

You catch my tears as they fall
It's like I never left at all
And all the world feels so small
Cause right now we are high above it all
So hold me close, don't ever let me go
Tell me what I already know

Oh oh oh oh, you're never far away
Oh oh oh oh, you're never far away
Oh oh oh oh, you're never far away
From me
[repeat]

Another mile down the road...
"
"""Sakura""",Christian Bautista,"""Outbound""","

You will always stay in my heart,
Oh my love, you're the reason why I believe in love uh oh
No one will ever take your place,
Oh my love, every single day, my love for you grows stronger
If you had another choice
Will you stay here with me
You know that, I don't wanna go

Don't say goodbye
If you still believe in us
My love will never fade away
Never ever fade away
Even if you're far away, far away
Memories will keep us close
Someday we will be
Together you and me
Forever

Nothing's gonna change my love for you
I promise my love forever
Just believe in me, no I won't make you cry
Promise me, no matter what, you'll be back
Nobody can ever replace, you, in my heart
I will always, we will always

Don't say goodbye
If you still believe in us
My love will never fade away
No, never fade away
Even if you're far away, so far away
Memories will keep us close
Someday we will be
Together you and me
Forever
Someday we will be
Just you and me
"
"""Come What May""",Christian Bautista,"""Soundtrack""","

Never knew, I could feel like this,
Like I've never seen the sky before
Want to vanish inside your kiss
Everyday I love you more and more
Listen to my heart can you hear it sing
Tellin' me to give you everything
Seasons may change, winter to spring
But I love you, until the end of time

Come what may, come what may
I will love you, until my dying day

Suddenly the world seems such a perfect place
Suddenly moves with such a perfect grace
Suddenly my life doesn't seem such a waste
It all revolves around you

And there's no mountain too high, no river too wide
Sing out this song and I'll be there by your side
Storm clouds may gather, and stars may collide
But I love you, I love you
Til the end of time, until the end of time

Come what may, come what may
I will love you, I will love you
Suddenly the world seems such a perfect place

Come what may, come what may
I will love you until my dying day
"
"""Up Where We Belong""",Christian Bautista,"""Soundtrack""","

Who knows what tomorrow brings
In a world few hearts survive?
All I know is the way I feel
When it's real, I keep it alive

The road is long
There are mountains in our way
But we climb a step every day

Love lift us up where we belong
Where the eagles cry
On a mountain high

Love lift us up where we belong
Far from the world below
Up where the clear winds blow

Some hang on to 'used to be'
Live their lives looking behind
All we have is here and now
All our life out there to find

The road is long
There are mountains in our way
But we climb a step every day

Love lift us up where we belong
Where the eagles cry
On a mountain high

Love lift us up where we belong
Far from the world we know
Where the clear winds blow

Time goes by, no time to cry
Life's you and I, a life, baby

Love lift us up where we belong
Where the eagles cry
On a mountain high

Love lift us up where we belong
Far from the world we know
Where the clear winds blow

Love lift us up where we belong
Love lift us up where we belong
"
"""How Deep Is Your Love""",Christian Bautista,"""Soundtrack""","

I know your eyes in the morning sun
I feel you touch me in the pouring rain
And the moment that you wander far from me
I want to feel you in my arms again
And you come to me on a summer breeze
Keep me warm in your love, then you softly leave
And it's me you need to show

How deep is your love, is your love
How deep is your love?
I really mean to learn
'Cause we're living in a world of fools
Breaking us down when they all should let us be
We belong to you and me

I believe in you
You know the door to my very soul
You're the light in my deepest, darkest hour
You're my savior when I fall
And you may not think that I care for you
When you know down inside that I really do
And it's me you need to show

How deep is your love, is your love
How deep is your love?
I really mean to learn
'Cause we're living in a world of fools
Breaking us down when they all should let us be
We belong to you and me

How deep is your love, is your love
How deep is your love?
I really mean to learn
'Cause we're living in a world of fools
Breaking us down when they all should let us be
We belong to you and me
"
"""When You Say Nothing At All""",Christian Bautista,"""Soundtrack""","

It's amazing how you
Can speak right to my heart.
Without saying a word
You can light up the dark.

Try as I may, I could never explain
What I hear when you don't say a thing.

[Chorus:]
The smile on your face
Lets me know that you need me.
There's a truth in your eyes
Saying you'll never leave me.
The touch of your hand says you'll catch me whenever I fall.
You say it best when you say nothing at all.

All day long I can hear
People talking out loud.
But when you hold me near (you hold me near)
You drown out the crowd.

Try as they may, they can never define
What's been said between your heart and mine.

[Chorus:]
The smile on your face
Lets me know that you need me.
There's a truth in your eyes
Saying you'll never leave me.
The touch of your hand says you'll catch me whenever I fall.
'Cause you say it best (you say it best) when you say nothing at all.

[Chorus:]
The smile on your face
Lets me know that you need me.
There's a truth in your eyes
Saying you'll never leave me.
The touch of your hand says you'll catch me whenever I fall.
'Cause you say it best (you say it best) when you say nothing at all.

(You say it best when you say nothing at all.
You say it best when you say nothing at all.)

That smile on your face,
The truth in your eyes,
The touch of your hand
Lets me know that you need me.
"
"""After All""",Christian Bautista,"""Soundtrack""","

Well, here we are again
I guess it must be fate
We've tried it on our own
But deep inside we've known
We'd be back to set things straight

I still remember when
Your kiss was so brand new
Every memory repeats
Every step I take retreats
Every journey always brings me back to you

After all the stops and starts
We keep coming back to these two hearts
Two angels who've been rescued from the fall
After all that we've been through
It all comes down to me and you
I guess it's meant to be
Forever you and me
After all

When love is truly right (this time it's truly right)
It lives from year to year
It changes as it goes
Oh, and on the way it grows
But it never disappears

After all the stops and starts
We keep coming back to these two hearts
Two angels who've been rescued from the fall
After all that we've been through
It all comes down to me and you
I guess it's meant to be
Forever you and me
After all

Always just beyond my touch
You know I needed you so much
After all, what else is livin' for?

After all the stops and starts
We keep coming back to these two hearts
Two angels who've been rescued from the fall
And after all that we've been through
It all comes down to me and you
I guess it's meant to be
Forever you and me

After all the stops and starts
We keep coming back to these two hearts
Two angels who've been rescued from the fall
And after all that we've been through
It all comes down to me and you
I guess it's meant to be
Forever you and me
After all
After all
After all
"
"""A Thousand Years""",Christian Bautista,"""Soundtrack""","

Heart beats fast
Colors and promises
How to be brave?
How can I love when I'm afraid to fall?
But watching you stand alone,
All of my doubt suddenly goes away somehow.

One step closer

I have died every day waiting for you
Darling, don't be afraid I have loved you
For a thousand years
I'll love you for a thousand more

Time stands still
Beauty in all she is
I will be brave
I will not let anything take away
What's standing in front of me
Every breath
Every hour has come to this

One step closer

I have died every day waiting for you
Darling, don't be afraid I have loved you
For a thousand years
I'll love you for a thousand more

And all along I believed I would find you
Time has brought your heart to me
I have loved you for a thousand years
I'll love you for a thousand more

One step closer
One step closer

I have died every day waiting for you
Darling don't be afraid I have loved you
For a thousand years
I'll love you for a thousand more

And all along I believed I would find you
Time has brought your heart to me
I have loved you for a thousand years
I'll love you for a thousand more
"
"""Cruisin'""",Christian Bautista,"""Soundtrack""","

Baby let's cruise away from here
Don't be confused, the way is clear
And if you want it, you got it forever
This is not a one night stand baby, yeah

Let the music take your mind
Just release and you will find

You're gonna fly away, glad you're goin' my way
I love it when we're cruisin' together
Music is played for love, cruisin' is made for love
I love it when we're cruisin' together

Baby tonight belongs to us
Everything right, do what you must
And inch by inch we grow closer and closer
To every lil' part of each other, ooh baby yeah

So let the music take your mind
Just release and you will find

You're gonna fly away, glad you're goin' my way
I love it when we're cruisin' together
Music is played for love, cruisin' is made for love
I love it when we're cruisin' together

Cruise with me baby, ooh yeah ooh
Ooh baby, let's cruise, let's float, let's glide
Ooh, let's open up and go inside

And if you want it, you got it forever
I could just stay here beside you and love you baby
Let the music take your mind
Just release and you will find

You're gonna fly away, glad you're goin' my way
I love it when we're cruisin' together
Music is played for love, cruisin' is made for love
I love it when we're cruisin' together

You're gonna fly away, glad you're goin' my way
I love it when we're cruisin' together
Music is played for love, cruisin' is made for love
I love it when, I love it, I love it, I love it, ooh
Cruise with me baby, I love it when we're cruisin together
"
"""Way Back Into Love""",Christian Bautista,"""Soundtrack""","

I've been living with a shadow over head
I've been sleeping with a cloud above my bed
I've been lonely for so long
Trapped in the past, I just can't seem to move on

I've been hiding all my hopes and dreams away
Just incase I ever need them again someday
I've been setting aside time
To clear a little space in the corners of my mind

All I want to do is find a way back into love
I can't make it through without a way back into love

I've been watching but the stars refuse to shine
I've been searching but I just don't see the signs
I know that it's out there
There's got to be something for my soul somewhere

I've been looking for someone to shed some light
Not somebody just to get me through the night
I could use some direction
And I'm open to your suggestions

All I want to do is find a way back into love
I can't make it through without a way back into love

And if I open my heart again
I guess I'm hoping you'll be there for me in the end

There are moments when I don't know if it's real
Or if anybody feels the way I feel
I need inspiration
Not just another negotiation

All I want to do is find a way back into love
I can't make it through without a way back into love

And if I open my heart to you
I'm hoping you'll show me what to do
And if you help me to start again
You know that I'll be there for you in the end

All I want to do is find a way back into love
I can't make it through without a way back into love

All I want is a way back into love
"
"""Love Is All Around""",Christian Bautista,"""Soundtrack""","

I feel it in my fingers
I feel it in my toes
Love is all around me
And so the feeling grows

It's written on the wind
It's everywhere I go,
So if you really love me
Come on and let it show

You know I love you, I always will
My mind's made up by the way that I feel
There's no beginning, there'll be no end
'cause on my love you can depend

I see your face before me
As I lay on my bed
I kinda get to thinking
Of all the things you said, oh yes I did

You gave your promise to me 
and I gave mine to you
I need someone beside me
In everything I do, 

You know I love you, I always will,
My mind's made up by the way that I feel
There's no beginning, there'll be no end
'cause on my love you can depend

Oh it's written in the wind
Oh everywhere I go, yeah, 
So if you really love me, love me, love me
Come on and let it show
Come on and let it show
Come on, come on and let it
come on let it show baby
Come on and let it show
Come on, come on and let it show
"
"""The Way We Were""",Christian Bautista,"""Soundtrack""","

Memories light the corners of my mind
Misty water-colored memories of the way we were

Scattered pictures of the smiles we left behind
Smiles we gave to one another for the way we were.

Can it be that it was all so simple then
Or has time rewritten every line
If we had the chance to do it all again, tell me, would we, could we

Memories may be beautiful and yet
What's too painful to remember we simply choose to forget
So it's the laughter we will remember
Whenever we remember the way we were.

The way we were.
"
"""Kiss From A Rose""",Christian Bautista,"""Soundtrack""","

There used to be a graying tower alone on the sea.
You became the light on the dark side of me.
Love remained a drug that's the high and not the pill.
But did you know, that when it snows,
My eyes become large and the light that you shine can be seen.

Baby, I compare you to a kiss from a rose on the gray.
Ooh, the more I get of you, the stranger it feels, yeah.
And now that your rose is in bloom, a light hits the gloom on the gray.

There is so much a man can tell you, so much he can say.
You remain, my power, my pleasure, my pain, baby
To me you're like a growing addiction that I can't deny.
Won't you tell me is that healthy, baby?
But did you know, that when it snows,
My eyes become large and the light that you shine can be seen.

Baby, I compare you to a kiss from a rose on the gray.
Ooh, the more I get of you the stranger it feels, yeah
Now that your rose is in bloom, a light hits the gloom on the gray.

I've been kissed by a rose on the gray,
And if I should fall along the way
I've been kissed by a rose on the gray.
I've been kissed by a rose on the gray.

There is so much a man can tell you, so much he can say.
You my power, my pleasure, my pain.
Baby to me you're like a growing addiction that I can't deny, 
Won't you tell me is that healthy, baby.

But did you know, that when it snows,
My eyes become large and the light that you shine can be seen.

Baby, I compare you to a kiss from a rose on the gray.
Ooh, the more I get of you the stranger it feels, yeah
Now that your rose is in bloom, a light hits the gloom on the gray.

Now that your rose is in bloom, a light hits the gloom on the gray.
"
"""Unchained Melody""",Christian Bautista,"""Soundtrack""","

Oh my love
My darling
Ive hungered for your touch
A long lonely time

And time goes by so slowly
And time can do so much
Are you still mine?

I need your love
I need your love
God speed your love
To me

Lonely rivers flow
To the sea
To the sea
To the open arms
Of the sea

Lonely rivers sigh
""Wait for me, wait for me""
Ill be coming home
Wait for me.

Oh my love
My darling
Ive hungered for your touch
Are you still mine?

Cause I need your love
I need your love
God speed your love
To me
"
"""Seasons Of Love""",Christian Bautista,"""Soundtrack""","

I never new love existed this way
That my dreams will be a better reality
I never thought that round and round in pain
will I ever be this happy

I didn't plan, I didn't see
I never thought that I would fall for you
so deep
And this time around
I'll let my heart take it's chance

Your my season of love, my season of love
Until another life this love will forever last
It's the best thing that ever happened to me
There's no place I'd rather be, only by your side is where I wanna be

The sweetest gift, greatest for all
To you I vow to give my all
Heaven said for me you would get
what else could I ever ask for

I didn't plan, I didn't see
I never thought that I would fall for you
so deep
And this time around
I'll let my heart take it's chance

Your my season of love, my season of love
Until another life this love will forever last
It's the best thing that ever happened to me
There's no place I'd rather be, only by your side is where I wanna be

Ooohhhh wooohhhh oooooohhhh, wooooooohhhhhh
And this time around
I'll let my heart take it's chance

Your my season of love, my season of love
Until another life this love will forever last
It's the best thing that ever happened to me
There's no place I'd rather be, only by your side is where I wanna be...
"
"""Kapit""",Christian Bautista,"""Kapit""","

Wala na bang natitirang pagmamahal
Kung dapat nang lumisan ba't nagtatagal

'Di ba nadaramang kailangan ka sinta
Ano bang nangyayari sa'yo?
Ba't di na marinig sigaw nang 'yong dibdib
Ano ba 'tong sinasapit?

'Wag kang bibitaw kapit sa akin
'Yan ang tangi kong hiling
'Di susuko kakapit sa iyo
Hanggang sa dulo ikaw lang at ako
'Wag kang bibitaw kapit, kapit, kapit
Sa akin kumapit, kapit, kapit

'Di ba mahihirapan ka pag umalis?
Maghihintay parin sa'yong pagbabalik

Ako'y nangangamba sa bilis ng yong pasya
Bakit ba nagkaka ganito?
Nakatago mong galit at lungkot binibitbit
Dinggin mo sana kahit saglit

'Wag kang bibitaw kapit sa akin
'Yan ang tangi kong hiling
'Di susuko kakapit sa iyo
Hanggang sa dulo ikaw lang at ako
'Wag kang bibitaw kapit, kapit, kapit
Sa akin kumapit, kapit, kapit

Kahit ano ay gagawin
Ikaw ang dahilan susundan kahit saan
Wag sanang mawala sakin
Ako ay pagbigyan kapit moy higpitan

'Wag kang bibitaw kapit sa akin
'Yan ang tangi kong hiling
'Di susuko kakapit sa iyo
Hanggang sa dulo ikaw lang at ako

'Wag kang bibitaw kapit (sa akin)
Di susuko kakapit ('yan ang tangi kong hiling)
'Wag kang bibitaw kakapit sa iyo (kapit, kapit, kapit)
Hanggang sa dulo (kapit, kapit, kapit)
"
"""Huling Harana""",Christian Bautista,"""Kapit""","

Wala na yata talagang makitang pag-asa
Wala na rin oras para isalba
Ang pag-ibig na dati atin ngayon ay alaala
Ang pagmamahalang masaya ngayon ay wala na

Hindi mo na kailangan ng maraming salita
Hindi mo na kailangang mag-isip at maawa
Alam ko naman na hindi ka na hindi na masaya
Kaya't ito ang huling ito nang aking huling harana

Ginawa ko lahat kahit wala ng halaga
Kahit alam kong iba na ang laman ng mga mata
Kulang pa rin kahit mundo ang kinalaban
Kulang pa rin kahit ginulo ang maayos na kapalaran

Hindi mo na kailangan ng maraming salita
Hindi mo na kailangang mag-isip at maawa
Alam ko naman na hindi ka na hindi na masaya
Masakit mahirap pero kaya
Masakit mahirap pero kaya

Hindi mo na kailangan ng maraming salita
Hindi mo na kailangang mag-isip at maawa
Alam ko naman na hindi ka na hindi na masaya
Hindi mo na kailangan ng maraming salita
Hindi mo na kailangang mag-isip at maawa
Alam ko naman na hindi ka na hindi na masaya
Kaya ito ang huli ito nang aking huling
Ito ang huli
Ito nang aking huling

Harana
"
"""Luna""",Christian Bautista,"""Kapit""","

Nakatitig sa buwan
Nag-iisa, nag-aabang
Umikot na ang mundo
Naiwang tulala sa 'yo

Kinakausap ang mga bituin
Oras, araw, panahon na bitin
Hanggang kailan kaya
Hahanapin ang wala?

Tinakpan na ng ulap ang ating pintuan
Pagbibigyan pa ba ang munting kahilingan
Na makasama kahit 'di na pwede?

Hawakan na lang ang ating gabi
Alaalang 'di maitabi

Nakatitig sa buwan
Nag-iisa, nag-aabang
Umikot na ang mundo
Naiwang tulala sa 'yo

Tinakpan na ng ulap ang ating pintuan
Pagbibigyan pa ba ang munting kahilingan
Na makasama kahit 'di na pwede?

Tinakpan na ng luha ang aking mga mata
Pagbibigyan pa kaya ang ating nakaraan?
Oh, kay saya kahit 'di na pwede
Oh, kahit 'di na pwede

Hawakan na lang ang ating gabi
Alaalang 'di maitabi
Yayakapin na lang ang ating gabi
Alaalang 'di maitabi
"
"""Musika""",Christian Bautista,"""Kapit""","

Dati, alam na alam mo
Ang tinig ng awit ko
Ilang nota pa lang, sasaya na ang iyong puso

Dati, damang-dama mo
Ang kilig ng himig ko
Basta't narinig mo lang, papanaw na ang lungkot mo

Ibalik natin pagmamahal nating hiling
'Wag limutin ang musika ng pag-ibig
Tayo'y lumikha ng bagong tinig
Huwag magsasawa sa awit natin
Whoa-oh-oh, whoa-oh-oh, oh-oh-oh
Whoa-oh-oh, whoa-oh-oh, oh-oh

Ibalik natin pagmamahal nating hiling
'Wag limutin ang musika ng pag-ibig
Ating sagipin muli ang awit natin
Ating palakasin ang musika natin
Whoa-oh-oh, whoa-oh-oh, oh-oh-oh
Whoa-oh-oh, whoa-oh-oh, oh-oh

Ating palakasin ang musika natin
Ating palakasin ang musika natin
"
"""Two Forevers""",Christian Bautista,"""Kapit""","

You're a quiet Sunday morning
A river gently flowing
You're the midnight stars glowing
Like diamonds on the ocean

Thought I'd never want someone
Like I want you when each day's done
It's in the magic of the moment
I touch heaven and hold it

One lifetime won't be enough
The way you love me this much
Baby it's hard to find the words
You're much more than I deserve
Oh let my eyes tell you the truth
I'll need two forevers with you

You're the courage I sometimes don't have
The forgiveness when I get mad
You're the laughter when I've lost mine
And the love that crosses all lines

One lifetime won't be enough
The way you love me this much
Baby it's hard to find the words
You're much more than I deserve
Oh let my eyes tell you the truth
I'll need two forevers with you

You're voice echoes in my soul
Like an angel I've always known
Before the start of time
You're love was written in the sky

One lifetime won't be enough
The way you love me this much
Baby its hard to find the words
You're much more than I deserve
Oh let my eyes tell you the truth
I'll need two forevers
I'll need two forevers with you
"
