Song,Artist,Album,Lyrics
"""Colour Everywhere""",Christian Bautista,"""Christian Bautista""","

Used to seeing black and white
Never really in between
Waiting for the love of my life
To come into my dreams
Everything is shades of gray
Never really blues or green

Needed someone else to turn to
Someone who could help me learn to see
All the beauty that was waiting for me

You, you put the blue back in the sky
You put the rainbow in my eyes
A silver lining in my prayers
And now there's colour everywhere

You put the red back in the rose
Just when I needed it the most
You came along to show you care
And now there's colour everywhere
Everywhere

My life is so predictable
Never any mystery
But ever since you shined the light
All of that was history
Now I have a hand to hold
And a reason to believe
There's someone in my life worth living for
I was hanging around just wishing on a star
To put the happines back in my heart and...

You, you put the blue back in the sky
You put the rainbow in my eyes
A silver lining in my prayers
And now there's colour everywhere

You put the red back in the rose
Just when I needed it the most
You came along to show you care
And now there's colour everywhere
Oh yeah...

You care and now there's colour everywhere

Left those hazy days behind me
Never to return again
Now they're just a fading memory
Coz baby it's all so clear to see
The beauty that is waiting there for me

You, you put the blue back in the sky
You put the rainbow in my eyes
A silver lining in my prayers
And now there's colour everywhere

You put the red back in the rose
Just when i needed it the most
You came along to show you care
And now there's colour everywhere
A silver lining in my prayers
And now there's colour everywhere

You came along to show you care
And now there's colour everywhere
"
"""Kailan Pa Ma'y Ikaw""",Christian Bautista,"""Christian Bautista""","

Ang pag-ibig ko'y tanging ikaw lamang
Ang puso kong ito
Ay para lang sa'yo
Magpakaylan ma'y hindi magbabago
Magpahangang wakas
Mananatili ka sa puso

Laging ikaw ang nasa isip ko
Ang buhay ko ay para sa'yo
Tanging ikaw lamang ang iibigin
Kahit sa oras ng pagtulog ko
Ikaw pa rin ang panaginip
At kahit na kailan pa ma'y ikaw pa rin

'Di ko iisipin na mayroong hangang
Pagmamahalan nati'y ganyan
Kung uulitin man ang buhay ko
Tanging ikaw pa rin
Ang nanaising makapiling

Laging ikaw ang nasa isip ko
Ang buhay ko ay para sa'yo
Tanging ikaw lamang ang iibigin
Kahit sa oras ng pagtulog ko
Ikaw pa rin ang panaginip
At kahit na kailan pa ma'y ikaw pa rin

Ikaw ang buhay ko at pangarap
Pag-ibig ko lahat ng sandali

Laging ikaw ang nasa isip ko
Ang buhay ko ay para sa'yo
Tanging ikaw lamang ang iibigin
Kahit sa oras ng pagtulog ko
Ikaw pa rin ang panaginip
At kahit na kailan pa ma'y ikaw
Laging ikaw ang nasa isip ko
Ang buhay ko ay para sa'yo
Tanging ikaw lamang ang iibigin
Kahit sa oras ng pagtulog ko
Ikaw pa rin ang panaginip
At kahit na kailan pa ma'y ikaw pa rin
"
"""Away From You""",Christian Bautista,"""Christian Bautista""","

[Intro:]
There were times that I just wanna cry with all the strain
There were moments of uncertainty and pain
But when you are there to help and care, I smile again
But here am I so alone away from you

[Chorus:]
Everyday I can only pray for your warm, lovin' arms
To take me away from all the emptiness, despair
Why do I have to be away from you

I have searched throughout the world a lot of things I've seen
I have pondered many possibilities
Then you come along, you make me strong so stay with me
Why am I on my own without you

[Chorus:]
On my own so far away I long from your warm lovin' arms
Into the cold, dark emptiness of hurt, despair
I don't wanna be away from you

[Chorus:]
Everyday I can only pray for your warm, lovin' arms
To take me away from all the emptiness, despair
Why do I have to be away from you

Please don't let me be

[Chorus:]
On my own so far away I long from your warm lovin' arms
Into the cold, dark emptiness of hurt, despair
I don't wanna be away from you
"
"""Kelan Kaya""",Christian Bautista,"""Christian Bautista""","

Mahal kita, ngunit mahal mo siya
hindi na sadyang mag-iiba
ang pag-ibig mong
dati ko pang inaasam
ang tibok ng puso ko sana'y pakinggan

kung minsan ba'y
iyong nadarama
pag-ibig kong mas higit sa kanya
pwede bang kahit saglit
ay malimutan siya
kahit sandali lamang 
ay maging akin ka

[Chorus]

kelan kaya
kita makakayakap
kelan kaya
ako makakahanap
ng isang katulad mong 
bihira na sa mundo
sana'y ingatan niya 
tulad pag-ingat ko sa puso mo

pilit ko nang makalimutan ka
hindi yata
sadyang mag-iiba
ang pag-ibig ko sayo
lamang nakalaan
at hindi kita iiwan
magpakaylanman

[Chorus]

kaya kitang mahalin
higit sa pagmamahal niya
"
"""Hands To Heaven""",Christian Bautista,"""Christian Bautista""","

As I watch you move
Across the moonlit room
There's so much tenderness in your loving
Tomorrow I must leave
The dawn knows no reprieve
God, give me strength when I am leaving

So raise your hands to heaven and pray
That we'll be back together someday

Tonight I need your sweet caress
Hold me in the darkness
Tonight you calm my restlessness
You relieve my sadness

As we move to embrace tears run down your face
I whisper words of love so softly
I can't believe this pain
It's driving me insane
Without your touch life will be lonely

So raise your hands to heaven and pray
That we'll be back together someday

Tonight I need your sweet caress
Hold me in the darkness
Tonight you calm my restlessness
You relieve my sadness
Tonight I need your sweet caress
Hold me in the darkness
Tonight you calm my restlessness
You relieve my sadness

Morning has come another day
I must pack my bags and say goodbye, goodbye...

Tonight I need your sweet caress
Hold me in the darkness
Tonight you calm my restlessness
You relieve my sadness
Tonight I need your sweet caress
Hold me in the darkness
Tonight you calm my restlessness
You relieve my sadness...
"
"""Ang Tangi Kong Kasama""",Christian Bautista,"""Christian Bautista""","

Habang ako ay nagiisa
Ikaw ang lagi kong alaala
Ang mga pangarap nating kay ganda
Bakit kaya ngayon naglaho na?

[CHORUS:]
Kapag mata ay pinipikit
Ikaw ang naiisip
Hanggang sa aking pagiglip
Ikaw ang panaginip
Lahat ng iniwan mong alaala
Sa Pagiisa ang tangi kong kasama

Hinding hindi ko maipagpapalit
Pagibig ko sa iyo kahit saglit
Wala man ang yakap na dati'y kay higpit
Wala man ang halik na kay init

[Repeat Chorus 2x]

..Hanggang sa aking pagiglip
Ikaw ang panaginip
Lahat ng iniwan mong alaala
Sa pagiisa ang tangi kong kasama
"
"""Miracle""",Christian Bautista,"""Christian Bautista""","

[Intro:]
I believe the fantasy
Of what might be you and me, yeah
Somehow I've known this moment
Written across the stars in the sky
Something like a miracle
Whether it be real or make believe
I cherish the emotion I never could feel
How a love so divine has taken me over my mind

[Chorus:]
Not a moment in time precious as this moment with you
The love we have is more than a miracle
Everyday of my life is carefully entwined with you
You're more than a miracle

You're takin' my heart away (to a wonderland)
You hold me in your arms (ever so tenderly)
I'll whisper words so true
It's a thrill I can't deny
How you touch me deep inside
I feel your love every little way, every single day
You're all I desire, that's why

[Chorus:]
Not a moment in time (oh no) precious as this moment with you
The love we have is more than a miracle (oh)
Everyday of my life is carefully entwined with you
You're more than a miracle

[Bridge:]
And as the days go by, I'll show just how much I love you so
You'll be here always in my heart
Around your way is where I'll be
Share my love so constantly
Each time I smile is all because of you
And you know it's true

[Chorus:]
Not a moment in time precious as this moment with you
The love we have is more than a miracle (oh)
Everyday of my life (everyday) is carefully entwined with you
You're more than a miracle

Not a moment in time precious as this moment with you
The love we have is more than a miracle
Everyday of my life is carefully entwined with you
You're more than a miracle
"
"""The Way You Look At Me (Acoustic)""",Christian Bautista,"""Christian Bautista""","

No one ever saw me like you do
All the things that I could add up too
I never knew just what a smile was worth
But your eyes say everything
Without a single word

'Cause there's somethin' in the way you look at me
It's as if my heart knows
You're the missing piece
You make me believe
That there's nothing in this world I can't be
I never know what you see
But there's somethin' in the way you look at me

If I could freeze a moment to my mind
It'll be the second that you touch your lips to mine
I'd like to stop the clock make time stands still
'Cause, baby, this is just the way
I always wanna feel

'Cause there's somethin' in the way you look at me
It's as if my heart knows
You're the missing piece
You make me believe
That there's nothing in this world I can't be
I never know what you see
But there's somethin' in the way you look at me

I don't know how or why
I feel different in your eyes
All I know is it happens every time

'Cause there's somethin' in the way you look at me
It's as if my heart knows
You're the missing piece
You make me believe
That there's nothing in this world I can't be
I never know what you see
But there's somethin' in the way you look at me

The way you look at me
"
"""I Don't Want To See You Cry Again""",Christian Bautista,"""Christian Bautista""","

I don't wanna see you cry again
Missed the pot of gold at rainbows end
cease the day you try to fly and fall
I just want to see you standing tall

I don't want to see you cry once more
Careful of the world by shutting doors
Not a bit affeted by the crowd
I only want to see you standing proud

Tell me where it hurts 
And I will ease your pain
Through the stormy hurl
I'll shield you from the rain
Gonna find what's wrong
I'm gonna make it right
Hoping with my song
There'd be no need to cry

And though you've shed
A thousand tears before
I don't want to see
You cry once more
And though it's been a while
Since your last grin
I just want to see you smile again

Together dreaming dreams
Of a brighter tomorrow
With hopes from day to day
Rid ourselves of the sorrow
We'll make this world
A better place to live
I don't want to see you cry again

I don't want to see another tear
Knowing that it flows from pain and fear
Rather I will show you how to live
Even if it takes my life to give
"
"""Everything You Do""",Christian Bautista,"""Completely""","

I love the way you smile
When I look in your eyes
I love the way you laugh
When I try to be funny
And how a tear rolls down your face
When I say no one could ever take your place

And baby when you sleep I watched you breathing
And baby when you dream I dream with you
'Cause everywhere you are is where I wanna be
It's true, everything you do
Makes me know how much I love you

The way you touch my lips right after every kiss
And softly whisper that I'm your everything
The way you pray  our love won't die
Every night just before you close your eyes

And baby when you sleep I watched you breathing
And baby when you dream I dream with you
'Cause everywhere you are is where I wanna be
It's true, everything you do
Makes me know how much I love you

And I believe
Somethings are meant to be
As sure as there is love
Yours is meant for me

And baby when you sleep I watched you breathing
And baby when you dream I dream with you
'Cause everywhere you are is where I wanna be
It's true, everything you do
Makes me know how much

And baby when you sleep I watched you breathing
And baby when you dream I dream with you
'Cause everywhere you are is where I wanna be
It's true, everything you do
Makes me know how much I love you
"
"""I Can Love You Easy""",Christian Bautista,"""Completely""","

We've been connected all this time
By an invisible string attached
From your heart to mine
We circle the obvious like
Satellites that roam around the earth
No. I'm never gonna let you go.

[Chorus:]
I can love you easy
If you give me the chance
Suddenly we feel so close
And it happens so fast
Let's take tonight
This heart can't lie believe me
Baby I can love you easy.

I hear you speak
And it's like a song
The funny thing is
I think we both knew it all along
We circle each other just like
Children on a crowded carousel
Oh, it's a story we have to tell.

[Repeat chorus]

We got so used to thinking
That one is always far
Love has a way of knowing
Exactly where you are.

[Repeat chorus]
"
"""My Heart Has A Mind Of Its Own""",Christian Bautista,"""Completely""","

People try and tell me that its crazy
You and I were never meant to be
I don't believe they know, and even if its so
I'm fallen anyway, no matter what they say.

[Refrain:]
A part of me is taking me by the hand
The world can't see, still they can't understand
Why can't they understand...

[Chorus:]
My heart has a mind of its own
Right or wrong it's gonna do
Only what it feel is true
I'll follow it where ever it goes
Anywhere it leads me to
My heart has a mind of its own.

Maybe we wont always be together
Maybe this'll last a thousand years
Ain't nobody knows, and even if they did
It wouldn't matter now
I'd love you anyhow.

[Repeat Refrain and Chorus]

My heart knows what I'm needing
My heart knows what I'm feeling
It knows me better than I know myself
My heart knows just what I'm missin'
All I have to do is listen
And listen well...

[Repeat Chorus]
"
"""Invincible""",Christian Bautista,"""Completely""","

I don't have nerves of steel
I have a heart that feels
I may have cried a million tears but i won't drown
I let myself unfold
Gave you my hand to hold
You took me beyond where I could see
And then you let go of me

I was damaged by the fall
Got the wind knocked out of me
To be standing here at all
I must be invincible

I don't have x-ray eyes
Don't have a heart so wise
How could I have known you'd let me down
If i have known that then
If my eyes were wide open
I still believe I would've risked it
There's no way I would've missed it

Ah...it's a blessing and a curse
Ah...but you find out just what you're worth
"
"""She Could Be""",Christian Bautista,"""Completely""","

She comes inside, been playing football with the guys
She's all highfives
And dirty footprints on the floor
Next thing I know
She's hanging out
She's got her dress and  high heels on and we're alone
I couldn't ask for nothing more
Ooh... I love the way
A simple smile reveals it all
She calls my name

She could be all I'm ever gonna need
She's like a beauty queen 
In just her t-shirt and her jeans
She could be just the one I've waited for
Could be a perfect score and more
(Yeah) she could be
She could be
She could be
Ohh...

It's friday night
And her friends are home by nine
We hit the show, tip the boouncer skip the line
Next thing I know
We're out the door
And now she's dancing in the rain, a fragile flame
Under the pale blue colored light
Ohhh. . I love the way
This girl is not afraid to fall
She calls my name
(She's calling out to me)

She could be all I'm ever gonna need
She's like a beauty queen 
In just her t-shirt and her jeans
She could be just the one I've waited for
Could be a perfect score and more
(Yeah) she could be
She could be
She could be

That one in a hundred million
A secret the words been keeping
The music that keeps
Repeating  keeps repeating inside your mind
Like an angel on your shoulder
That makes your colors bolder than you dare
And you want to take her everywhere
She could be
Hey, yeah

Ohh... she could be all I'm ever gonna need
She's like a beauty queen 
In just her t-shirt and her jeans
She could be just the one I've waited for
Could be a perfect score and more
(Yeah) she could be
She could be
She could be ll I'm ever gonna need
She's like a beauty queen 
In just her t-shirt and her jeans
She could be just the one I've waited for
Could be a perfect score and more
(Yeah) she could be
She could be
She could be
Ohh...
"
"""Now That You Are Here""",Christian Bautista,"""Completely""","

I found you at last
You are worth the wait
Now I know that love is never late
Most times I ask
Where have you been all this time
But it doesn't matter now
Coz you are mine

[Chorus 1:]
Now you are so near
Your breath I hear
I've been waiting so long for you
I thought I'd never find you
But now I'm sure
This love will be real, ohhh..
I found you at last
You are worth the wait
Now I know that love is never late
My search has ended
My heart is mended
But your love that is true
And my love that is you

[Chorus 2:]
And now that you are here
Flowin' with love and care
Imagine all the years
That we will spend together
I can't wait to start my life with you.

[Bridge:]
Many sunstes have past
Each one lonely, never lovely
But you came here today
You she'd light to my dark days.

Now you are so near
Your breath I hear
I've been waiting so long for you
I thought I'd never find you
But now I'm sure
This love will be real

[Repeat Chorus 2 higher / moving Chorus 1 fret higher]
"
"""After You""",Christian Bautista,"""Completely""","

Took a walk last sunday just to get out
Clear away the cobwebs and the taste in my mouth

This city I'm living in just ain't bringing me round
Thought I can lose you by moving downtown

With every step I took I saw you there
And when I start talkin to myself
I know I'm getting nowhere

After you
There's no over you
There's no in-between
No good songs to sing

'cause after you
There's no someone new
There's no start again
'cause no matter where I go or what I do
I go after you
Even the sunshine isn't as bright as it was
But how would I know that when I never look up

I'm so fulla shoulda woulda coulda and a ton of regret
Lookin for answers but nothing's come to me yet

So I try to distract myself with everything and nothin'
Lookin' for answers but nothin's come to me yet

So I try to distract myself with everything and nothin'
But tommorow I'll wake up and still be runnin'

After you... I got so low I didn't even regognize myself
Or the wind blow
But here I am with nowhere, left to go
"
"""Please Don't Go""",Christian Bautista,"""Completely""","

I didnt mean what I said
My mind wasnt right
I wasnt thinking straight
Didnt mean to start a fight
Oh baby please dont leave
My heart is overloading
Oh I cant bear you gone
I feel your hand is slipping

Please dont go
Oh please dont go
Ill change my world for you
Anything I will do
Just dont leave me now
My heart is one with you
If you leave it stops beating
When Im away from you
The earth is not just turning
Oh girl without your touch
All warmth in me is leaving
I love you so much
This truth you must believe in

Please dont go
Oh please dont go
Girl I can taste my tears
Please quiet all my fears
And dont leave me now

My heart cant take another blow
Without your love
I just dont know
What my life is for
If I cant love you anymore

Coz eversince you came
My lifes a new beginning
I was so desolate but you came in
And breathe in a new life to me
I never thought Ill have you alone
And inly you can make me feel glad
"
"""Since I Found You""",Christian Bautista,"""Completely""","

I think of you in everything that I do
To be with you, what ever it takes I'll do
'Cause you, my love, you're all my heart desires
You've lighten up my life, forever I'm alive

Since I found you, my world seems so brand new
You've shown me the love I never knew
Your presence has sparked my whole life through
Since I found you, my life begins anew
Now, who needs a dream when there is you?
For all of my dreams came true
Since I found you

Your love shines bright
Through all the corners of my heart
Maybe you are my dearest heart
I give you all I have, my heart, my soul, my life
My destiny is you
Forever true
I'm so in love with you

Since I found you, my world seems so brand new
You've shown me the love I never knew
Your presence has sparked my whole life through
Since I found you, my life begins anew
Now, who needs a dream when there is you?
For all of my dreams came true
Since I found you
My heart forever true
In love with you

Since I found you
You've shown me the love I never knew
You've shown the love I never knew
Since I found you, my life begins anew
Now, who needs a dream when there is you
My life begins anew
Since I found you
"
"""Completely""",Christian Bautista,"""Completely""","

How can I tell you what I'm feeling
So you would always remember ooh ooh
What can I do to take this moment
And make it last forever
I know it's been said many times, many ways
But it's never come from a deeper place

[Chorus:]
For every minute of this life that I am breathing
Until there's nothing in this world I can believe in
As long as there's a single part of you that needs me
I know I am gonna to love you, completely
What did I do to get an angel
Lying here beside me ooh ooh
Where did you find all these emotions
I felt deep down inside me
I only know that this world will change
But your hold on my heart will stay the same

[Repeat Chorus]

[Bridge:]
I have no doubt at all
No fear of falling down
Completely, 
Be with me, 
Believe me, 
You will always know

Until there's nothing in this world I can believe in
As long as there's a single part of you that needs me
I know I am gonna to love you
I know I am gonna to love you, 
Completely
"
"""For Everything I Am""",Christian Bautista,"""Completely""","

I may not be beside you every day
I may run out of tender words to say
Cant promise you the world
When all I have is love
Only love

I may not be the one your thinking of
I may not fit your perfect dreams of love
One thing I know for sure
And you can rest assure
My love is always yours
Oh baby
Wont you look into my eyes and see
Beyond the things Im not, theres love inside of me
Just love me for all things I am, love me
The lighter side, the darkest side
Try to love me for everything I am

You, you been inside
Youve seen the darkest side of me
Ive shown you everything I am, everything
"
"""Nais Ko""",Christian Bautista,"""Completely""","

Malayo pa lang, kumakaway ka na
'Di mapigil ang saya na tayo'y magkikita
Kailan lang nang tayo'y nagkakilala
Tinginan mo nga naman, ngayon ay ka-barkada

Ka-kuwentuhan ng kung anu-ano
Ka jamming sa mga awiting uso
Ka halakhakan at ka-biruan
Sa araw-araw, 'di pagsasawaan

Nais ko ay makasama ka
Ka-hati sa walang hanggang ligaya
Ka-tawanan magmula umaga
Ako'y nasasabik sa bawat araw
Dahil ka-piling ko ay laging ikaw

Salamat at nakilala ka
Salamat sa araw na tayo'y nagkita
Umaga man, tanghali o gabi
Natutuwa akong makita kang muli

Nais ko ay makasama ka
Ka-hati sa walang hanggang ligaya
Ka-tawanan magmula umaga
Ako'y nasasabik sa bawat araw
Dahil ka-piling ko ay laging ikaw

Dahil ka-piling ko ay laging ikaw
"
"""Trying To Get The Feeling Again""",Christian Bautista,"""Just A Love Song...Live!""","

At any moment she'll be walking through that door
But she won't find me behind it
'Cause the feelin' is gone and just won't come back anymore
I worked so hard to find it

I've been up, down, trying to get the feeling again
All around tryin' to get the feeling again
The one that made me shiver
Makes my knees start to quiver every time she walks in

I've look high, low, everywhere I possibly can
But there's just no tryin' to gt the feeling again
It seemed to disappear as fast as it came

Read every book, looked for every meditation and poem
Just to bring home that old sweet sensation
But it ain't no use to me to try to get the feeling again

Where did it run to I thought I'd done all that I could
Just to keep the love light burnin'
But whatever I've done I just haven't done it too good
Coz all that's left is yearnin'
Could you help me rediscover the way to re-be her lover once again

Read every book, looked for every meditation and peom
Just to bring home that old sweet sensation
But it ain't no use to me to try to get the feeling
I want to get that feeling again

I've been up, down, tryin' to get the feeling
I've been up, down, tryin' to get the feeling
I've been up, down, tryin' to get the feeling
I've been tryin' to get the feelin' again
"
"""More Than You'll Ever Know""",Christian Bautista,"""Just A Love Song...Live!""","

Now don't you worry anymore
'Cause I told you before
I am never ever leaving you
Believe our love will make it through

Take my hand
We'll walk a while, we'll talk a while
Feel my love
Always there beside you
Be the one
I know you'll tell me everything
You are the one
I cherish more than anything

I love you more than
You'll ever know
I love you more than
You'll ever see
More than my heart
Could ever show
I love you more than
You'll ever know

Think of me
And know that I'll believe in you
There'll always be
This precious time together
With every tear
A love so strong
No words could ever say
A love to last forever

I love you more than
You'll ever know
I love you more than
You'll ever see
More than my heart
Could ever show
I love you more than
You'll ever know...

Take my hand
We'll walk a while, we'll talk a while
Feel my love
Always there beside you
Be the one
I know you'll tell me everything
You are the one
A cherish more than anything

I love you more than
You'll ever know
I love you more than
You'll ever see
More than my heart
Could ever show
I love you more than
You'll ever know, ooh...

More than you'll... ever know...
"
