Song,Artist,Album,Lyrics
"""Anak""",Lani Misalucha,No Album,"

Noong isilang ka sa mundong ito
Laking tuwa ng magulang mo
At ang kamay nila ang iyong ilaw
At ang nanay at tatay mo'y
Di malaman ang gagawin
Minamasdan pati pagtulog mo
At sa gabi'y napupuyat ang iyong nanay
Sa pagtimpla ng gatas mo
At sa umaga nama'y kalong ka
Ng iyong amang tuwang-tuwa sa iyo
Ngayon nga ay malaki ka na
Nais mo'y maging malaya
Di man sila payag
Walang magagawa
Ikaw nga ay biglang nagbago
Naging matigas ang iyong ulo
At ang payo nila'y sinuway mo
Di mo man lang inisip na
Ang kanilang ginagawa'y para sa iyo
Pagkat ang nais mo'y
Masunod ang layaw mo
Di mo sila pinapansin
Nagdaan pa ang mga araw
At ang landas mo'y naligaw
Ikaw ay nalulong sa masamang bisyo
At ang una mong nilapitan
Ang iyong inang lumuluha
At ang tanong,""anak, ba't ka nagkaganyan""
At ang iyong mga mata'y biglang lumuha ng di mo napapansin
Nagsisisi at sa isip mo'y
Nalaman mong ika'y nagkamali
Nagsisisi at sa isip mo'y
Nalaman mong ika'y nagkamali
Nagsisisi at sa isip mo'y
Nalaman mong ika'y nagkamali...
"
"""Bayan Kang Magiliw (Awit Sa Ating Bayang Minamahal)""",Lani Misalucha,No Album,"

Bayan kang magiliw sa amin
Kailan pa ma'y hindi magdidilim
Busilak ang dilaw, puti, pula, bughaw
Dama sa 'yong tatlong bituin at araw

Sa dami ng iyong pinagdaanan
Iba't ibang sigwa ang naranasan
Kapit lang sa Dios na may pagtitiwala
Pinagtagumpayan nang mapayapa

Magkaisang tinig, sa panalangin pagpalain
Ang pinakamamahal na lupang hinirang natin
Watawat mo'y itataas, itatanyag, itatanghal
Ang awit sa ating bayang minamahal

Tunay ang pagmamahal sa'yo
Buhay ay langit sa piling mo
Duyan ng magiting ang pumipintig
Lulan ng walang hanggang pag-ibig

Magkaisang tinig, sa panalangin pagpalain
Ang pinakamamahal na lupang hinirang natin
Watawat mo'y itataas, itatanyag, itatanghal
Ang awit sa ating bayang minamahal

Namumukod-tanging pagsinta, sa dibdib mo'y buhay
Walang kasing alab ng pusong binibigyang pugay
Binibigyang pugay

Magkaisang tinig, sa panalangin pagpalain
Ang pinakamamahal na lupang hinirang natin
Watawat mo'y itataas, itatanyag, itatanghal
Ang awit sa ating bayang minamahal

Watawat mo'y itataas, itatanyag, itatanghal
Ang awit sa ating bayang minamahal

Bayan kang magiliw
Bayan kang magiliw sa amin
"
"""Bayaning Tunay""",Lani Misalucha,"""Songs From Home""","

[Gary V:]
Bawat araw ay may digmaan
Di mo man lang nakikita ang kalaban

[RVA:]
Balot na balot sa panablang saplot
Halos walang pahinga

[ZZP:]
At kagipita'y hindi nila iniinda
[POPS:]
Di man lang makapiling ang pamilya
[Erik:]
Ang maglingkod ang kanilang isinumpa
[Angeline:]
Kahit buhay pa nila ang nakataya

[Sam C:]
Kailangan na sila ay tulungan
[KZ:]
Hindi natin sila dapat kalimutan
[Lea:]
Sino pa ba kundi tayo-tayo rin
Ang kikilos para sa bayan natin

[Martin:]
Saludo, saludo
Sa inyong kabayanihan
[Ogie:]
Salamat, salamat
Sa inyong pagmamalasakit
[Piolo:]
Mahal namin kayo, ng taos puso
[Martin / Ogie / Piolo:]
Bayaning tunay kayo

[Bamboo:]
Saludo, saludo
Sa inyong kabayanihan
[Ely:]
Salamat, salamat
Sa inyong pagmamalasakit
[Rico:]
Mahal namin kayo, ng taos puso
Bayaning Tunay kayo

[Lani:]
Kayrami ng mga nasawi
Sa puso natin sila'y Mananatili
[Morissette:]
Hindi sa ganito matatapos ito
[Janine:]
Magsama-sama na tayo

[Christian B / Kyla:]
Saludo, saludo
Sa inyong kabayanihan
[Jed and Klarisse:]
Salamat, salamat
Sa inyong pagmamalasakit
[Jason Dy / Noel C / Nyoy:]
Mahal namin kayo, ng taos puso
Bayaning tunay kayo

[All (with aria by Lara Maigue):]
Saludo, saludo
Sa inyong kabayanihan
Salamat, salamat
Sa inyong pagmamalasakit
Mahal namin kayo, ng taos puso
Bayaning tunay kayo
Bayaning tunay kayo
"
"""Bukas Na Lang Kita Mamahalin""",Lani Misalucha,No Album,"

Kay hirap palang umibig sa di tamang panahon
Kung bakit ngayon ko lang natagpuan ang isang katulad mo

Sana noon pakita nakilala
Sana noon pa lang na ang puso ay malaya pang magmahal

Bukas nalang kita mamahalin
Sabay sa paglaya ng ating mga puso
Bukas na lang kita mamahalin

Kay hirap pa lang umibig sa di tamang panohon
Kung bakit ngayon ko lang natagpuan ang isang katulad mo

Sana noon pakita nakilala
Sana noon pa lang na ang puso ay malaya pang magmahal

Bukas nalang kita mamahalin
Sabay sa paglaya ng ating mga puso
Bukas na lang kita
Bukas na lang kita
Bukas na lang kita
Mamahalin
"
"""Grown Up Christmas List""",Lani Misalucha,No Album,"

Do you remember me?
I sat upon your knee
I wrote to you
With childhood fantasies

Well I'm all grown up now
Can you still help somehow
I'm not a child
But my heart still can dream

So here's my lifelong wish
My grown up Christmas list
Not for myself
But for a world in need

No more lives torn apart
That wars would never start
And time would heal all hearts

And everyone would have a friend
And right would always win
And love would never end
This is my grown up Christmas list

As children we believe
The grandest sight to see
Was something lovely
Wrapped beneath the tree

But heaven surely knows
That packages and bows
Can never heal a hurting human soul

No more lives torn apart
That wars would never start
And time would heal our hearts

And everyone would have a friend
And right would always win
And love would never end, no
This is my grown up Christmas list

What is this illusion
Called the innocence of youth
Maybe only in our blind belief
Can we ever find the truth
Ohhh

No more lives torn apart
(No more torn apart)
That wars would never start
(Never start)
And time would heal all hearts
(Oh, hearts)

Everyone would have a friend
(One would have a friend)
And right would always win
(Would always win)
And love would never end
(Never, never end, no)

This is my grown up Christmas list
This is my only lifelong wish
This is my grown up Christmas list
"
"""Healing""",Lani Misalucha,No Album,"

Now that we have gotten through
One more fall
I can just admit I've got it all
Cause I do
Cause I've got you
We've crossed these battle lines to many times
It passes through the heart
But it never leaves a mark

Cause Your love just keeps on healing me
No matter how I bruise
If I just trust You
Your love just keeps on healing me
One more clue
One more chance that wasn't there before
In your arms
No pain can harm the way I'm feeling
Lord I know that Your love is healing

I've kicked around those lines inside my head
But I've never listened to the words that You said
See where it's lead
Well I know I have it now
Cause You showed me how
And all I had to do
Was just to keep my eyes on You

Cause Your love just keeps on healing me
No matter how I bruise
If I just trust You
Your love just keeps on healing me
One more clue
One more chance that wasn't there before
In your arms
No pain can harm the way I'm feeling
Lord I know that Your love is healing

Cause Your love just keeps on healing me
No matter how I bruise
If I just trust You
Your love just keeps on healing me
One more clue
One more chance that wasn't there before
In your arms
No pain can harm the way I'm feeling

Lord I know that Your love is healing
"
"""I Can't Give Anymore""",Lani Misalucha,No Album,"

I gave my all to you
You took the best of me
I should have left before
I was torn completely
Wondering, can we come back from this?
Wishing I'd get back what we had
All our moments of bliss

I don't want to try
I don't want to write our love story
Another story with an ending that leads nowhere

I can't give anymore
I can't give anymore
Our last petal falls
I lost my life to keep you
I never left your side
But I can't give anymore
What was this for?

You have no remedy
It's all been said and done
It's time we realize this is our setting sun
Here I am, nothing left to prove
I keep tryin' to fight but I still
Can't get through to you

I don't want to try
I don't want to write our love story
Another story with an ending that leads nowhere

I can't give anymore
I can't give anymore
Our last petal falls
I lost my life to keep you
I never left your side
But I can't give anymore

We both can see it
We both can see the end
We both can see it
We both can see the end

Thought I could win, try it again
But the memories keep burning my mind
Hoped I still could but I

I can't give anymore
I can't give anymore
Our last petal falls
I lost my life to keep you
I never left your side
But I can't give anymore
What was this for?

I can't give anymore
What was this for?
"
"""Iisa Lang""",Lani Misalucha,No Album,"

Pagibig na walang hanggan
Tanging sa'yo lamang inaaalay
Sana ay tanggapin ang pagibig na wagas
Asahan mo na hanggang wakas

At sa pagsapit ng gabi
Nais ko'y nariyan ka sa'king tabi
Minsan lang ako nangarap ng ganito
Sana nama'y magkatotoo

Iisa lang ang tinitibok ng puso
Iisa lang ang tanging mamahalin
Kung may dal'wang mahalagang tao dito sa mundo
Wala ng iba kundi ikaw at ako

Giliw sana'y pakinggan mo
Ang tunay kong nadarama
Totoong pagsinta at wala ng iba pang
Mamahalin at sasambahin

Iisa lang ang tinitibok ng puso
Iisa lang ang tanging mamahalin
Kung may dal'wang mahalagang tao dito sa mundo
Wala ng iba kundi ikaw at ako

Wala ng iba, kundi ikaw
Wala ng iba, kundi ikaw at ako
"
"""Iisa Pa Lamang""",Lani Misalucha,No Album,"

Sa dinami-dami ng aking minahal
Panandalian lamang at ilan ang nagtagal
Iisa pa lamang ang binabalikan
Alaala ng kahapong pinabayaan

Sa dinami-dami ng aking nakapiling
Kung sinu-sino ang umibig sa akin
Iisa pa lamang ang inaasam-asam
Ang nakalipas di maaaring balikan

At kahit iba na ang minamahal
Kung sinuman ang siyang may-ari ng iyong puso
Bawa't pangalan, kalaro't kaibigan
Iisa pa lamang ang minahal ko ng ganito

Sa dinami-dami ng aking nakapiling
Kung sinu-sino ang umibig sa akin
Iisa pa lamang ang inaasam-asam
Ang nakalipas di maaaring balikan

At kahit iba na ang minamahal
Kung sinuman ang siyang may-ari ng iyong puso
Bawa't pangalan, kalaro't kaibigan
Iisa pa lamang ang minahal ko ng ganito

At kahit iba na ang minamahal
Kung sinuman ang siyang may-ari ng iyong puso
Bawa't pangalan, kalaro't kaibigan
Iisa pa lamang ang minahal ko ng ganito
Iisa pa lamang
Iisa pa lamang
Iisa pa lamang ang minahal ko ng ganito
"
"""Isang Panalangin""",Lani Misalucha,No Album,"

Bumubulong ang langit
Sa ating mga puso
Nagpapaalala
Na ang Diyos ay pakinggan
Maging tunay sa paglilingkod
Sa kapwa at bayan
Buhayin natin
Ang pagmamahalan

Kay dilim man ng ating landasin
Huwag bibitiw, huwag lisanin
Iyong alalahanin
Pagsubok ay lilipas din
Nasa ating kamay
Ang tunay na pag-asa
Sa gabay ng Ama
Na lagi nating kasama

Isang panalangin
Isang panalangin ko'y mamalas
Katunlaran ng bayong Pilipinas
At sa bawat Pilipino
Dalangin ay maging maliwanag ang bukas
At manalig sa Diyos sundin kanyang landas
Isang panalangin ko'y maging ganap
Ang kapayapaan sa mundo

Nasa ating kamay
Ang tunay na pag-asa
Ang biyayang yaglay
Sa kapwa ay mag-alay

Isang panalangin
Isang panalangin ko'y mamalas
Kaunlaran ng bayang Pilipinas
At sa bawat Pilipino
Dalangin ay maging maliwanag ang bukas
At manalig sa Diyos sundin kanyang landas
Isang panalangin ko'y maging ganap
Ang kapayapaan sa mundo
Pag-ibig ay ialay... mo
(Ang pag-ibig ay ialay mo)
"
"""Malaya Ka Na""",Lani Misalucha,No Album,"

Oh ah ah ah
Oooohh ohh, ah ah

Di ko na makakayang
Mag sa walang kibo na lamang
Di ko na magagawang maglihim pa sa iyo

At kung ina-asaahan mong
Magbabalik pa ang puso ko sayo
Matapos mong saktan at malinlang

Dapat sana'y hawak ang 'yong kamay
Kung nag-isip ka lang, hindi na masasaktan
Ang isa't isa

Malaya ka na, magagawa mo na
Ang lahat ng gusto mo
Kahit masaktan man ako
Malaya ka na, wag ka nang umasa pang
Magbabalik ako, lilimutin ka't
Hindi mabibigo

Ang tanging kong hangad sa'yo
Maging tapat ka sa damdamin mo sa kung
Sino mang magmamahal sa iyo
Dapat lamang, limutin na kita
Kung nag-isip ka lang
Hindi na masasaktan ang isat-isa

Malaya ka na, magagawa mo na
Ang lahat ng gusto mo
Kahit masaktan man ako
Malaya ka na, wag ka nang umasa pa
Magbabalik ako, lilimutin ka't
Hindi mabibigo

Oh oh oh
Kung ika'y nagbago na't, nag-iisa
Sana ang puso ko'y
Malaya pa, at kung 'di na
At mayroon ng may-ari na ng puso ko
Di mo masisisi ako, Ohhhh oh oh

Malaya ka na, magagawa mo na
Ang lahat ng gusto mo
Kahit masaktan man ako
Malaya ka na, wag ka nang umasa pa
Magbabalik ako, lilimutin ka't
Hindi mabibigo

Ang lahat ng gusto mo
Kahit masaktan man ako
Malaya ka na, wag ka nang umasa pa
Magbabalik ako, lilimutin ka't
Hindi mabibigo... Oohhh
Mmmh mmmhh

Malaya ka na
"
"""May Bukas Pa""",Lani Misalucha,No Album,"

Huwag damdamin ang kasawian
May bukas pa sa iyong buhay
Sisikat din ang iyong araw
Ang landas mo ay mag-iilaw

Sa daigdig ang buhay ay ganyan
Mayroong ligaya at lumbay
Maghintay at may nakalaang bukas

May bukas pa sa iyong buhay
Tutulungan ka ng Diyos na may lalang
Ang iyong pagdaramdam
Idalangin mo sa Maykapal
Na sa puso mo ay mawala nang lubusan

Sa daigdig ang buhay ay ganyan
Mayroong ligaya at lumbay
Maghintay at may nakalaang bukas

May bukas pa sa iyong buhay
Tutulungan ka ng Diyos na may lalang
Ang iyong pagdaramdam
Idalangin mo sa Maykapal
Na sa puso mo ay mawala nang lubusan

Ang iyong pagdaramdam
Idalangin mo sa Maykapal
Na sa puso mo ay mawala nang lubusan
"
"""Meteorite""",Lani Misalucha,No Album,"

Just a rocket in flight
Speeding at a million miles
I'm standing here breathless
'Cause you've taken all the air tonight
I dust myself off the floor
And tried to get a grip on life
You hit me like a freight train
In the storm

I'm tryin' to resist but you're way too strong
You're pullin' me in like a sad love song
Zero gravity and you're only gettin' closer

There's nowhere to run
You're gonna crash right into me
I've tried to fight it
But you hit me like a meteorite
There's nowhere to go
I know that I'm about to fall
Ain't nowhere that I can hide
You hit me like a meteorite

([?]
You hit me like a meteorite)

Like the hummingbird's heart
I'm racing just to survive
I'm standing here headless
Needing you just to fly
Burning here in the fire
You pulled me into the flame
Like the moth to the light
I wanna be closer

I'm tryin' to resist but you're way too strong
You're pullin' me in like a sad love song
Zero gravity and you're only gettin' closer

There's nowhere to run
You're gonna crash right into me
I've tried to fight it
But you hit me like a meteorite
There's nowhere to go
I know that I'm about to fall
Ain't nowhere that I can hide
You hit me like a meteorite

We'll blaze, we'll rise
We'll soar on high
We'll hold on tight
As we collide

There's nowhere to run
You're gonna crash right into me
I've tried to fight it
But you hit me like a meteorite
There's nowhere to go
I know that I'm about to fall
Ain't nowhere that I can hide
You hit me like a meteorite

You hit me like a meteorite

Meteorite, meteorite
Meteorite, meteorite
Meteorite, meteorite
You hit me like a meteorite
Meteorite, meteorite
Meteorite, meteorite
Meteorite, meteorite
You hit me like a meteorite
"
"""Saan Darating Ang Umaga""",Lani Misalucha,No Album,"

Bakit pa pinagtagpo?
Pala'y maglalayo
Tayo sa ating buhay
Ang araw na kay ganda
Ba't ng lumisan ka
Ay nagdilim ang buhay

Ang umaga'y nagtampo
Ano't kasama mo
Luha ang tanging iwan
Kung sya may magbabalik
Ako'y nananabik
Kung kailan at saan

Darating ba syang kasama ka?
Masasalubong man lang ba kita?
Subalit ako'y nagaalala
Kung ako ay mahal mo pa

Kahit pa anong hadlang
Mananatili kang mahal sa aking tunay
May umaga man pala
Kung d ka nya dala
Ito'y walang buhay

Darating ba syang kasama ka?
Masasalubong man lang ba kita?
Subalit ako'y nagaalala
Kung ako ay mahal mo pa

Kahit pa anong hadlang
Mananatili kang mahal sa aking tunay
May umaga man pala
Kung d ka nya dala
Ito'y walang buhay
Ito'y walang buhay
"
"""Starting Over Again""",Lani Misalucha,No Album,"

And when I hold you in my arms I promise you
You're gonna feel a love that's beautiful and new
This time I'll love you even better
Than I ever did before
And you'll be in my heart forever more
We we're just too young to know

We fell in love and let it go
So easy to say the words goodbye
So hard to let the feelings die
I know how much I need you now
The time is turning back somehow
As soon as our hearts and souls unite
I know for sure we'll get the feeling right

And now we're starting over again
It's not the easiest thing to do
I'm feeling inside again
Cause everytime I look at you
I know we're starting over again
This time we'll love all the pain away
Welcome home my lover and friend
We are starting over, over again

If we never lived alone
And then we might have never known
All of the time we spent apart
All we did was break each other's hearts

And when I hold you in my arms I promise you
You're gonna feel the love that's beautiful as you
This time I'll love you even better than I ever did before
And you'll be in my heart forever more

And now we're starting over again
It's not the easiest thing to do
I'm feeling inside again
Cause everytime I look at you
I know we're starting over again
This time we'll love all the pain away
Welcome home my lover and friend
We are starting over, over again
Welcome home my lover and friend
We are starting over, over again
We are starting over, over again
"
"""Tila""",Lani Misalucha,No Album,"

Tila inulan ang puso ko
Nang naglamig ang 'yong pagsuyo
O bakit nagbago ang iyong pagtingin
Parang malamig na panahon

At nang ikaw ay kinausap ko
Habang ang ulan ay bumubuhos
Nakita ko sayong mga mata
Na gaganda ang panahon.

Tila hihina rin ang ulan
Tila lilipas din ang bagyo
Kahit madilim ang kalawakan may nagtatagon sinag sa ulap

Tila inulan ang puso ko
Nang parang naglaho ang pagibig mo
O bakit ka kaya nagbago
Sinlamig ng panahon

Tila hihina rin ang ulan
Tila lilipas din ang bagyo
Liliwanag din ang kalangitan
At ang araw ay sisikat nang muli

Ang karimlan ay haharapin
Matatanaw ko rin
Bughaw na langit
Umaasang pagibig mo ay magbabalik

Pawiin mo ang lungkot sa puso ko
Kahit madilim ang kalawakan
May nagtatagong sinag sa ulap
Tila hihina rin ang ulan
Tila lilipas din ang bagyo
Liliwanag din ang kalangitan
At ang araw ay sisikat nang muli
"
"""Timeless""",Lani Misalucha,No Album,"

Paint me a picture eternally mine
Like Mona Lisa to last for all time
Play me a classic from yesterday
Carefully patient your work of art
Masterpiece building right from the start
Write me a love song straight from your heart

As we get older and time passes over
The memories will come back again
Like the golden years

Just like a melody playing in my mind
Just like a song sung forever in time
So timeless, my love is timeless
And we remember the days gone past
Just like a poem that's written to last
You're timeless, what we have is endless
We're forever timeless

Let's write our future and learn from the past
The beauty surrounds us, we'll never look back
No matter what we go through, we'll stand the test of time

As we get older and time passes over
The memories will come back again
Like the golden years
Just like a melody playing in my mind
Just like a song sung forever in time
So timeless, what we have is endless
We're forever

Now look deep down inside of you
You're the greatest of them all
Destiny I confide in you
We'll rise and stand tall, forevermore

Just like a melody playing in my mind
Just like a song sung forever in time
So timeless, my love is timeless
And we remember the days gone past
Just like a poem that's written to last
You're timeless, what we have is endless
We're forever, timeless

You know our love is endless
We're forever, timeless
"
"""Tubig At Langis""",Lani Misalucha,No Album,"

Tubig at langis
Ang katayuan nati'y yan ang kawangis
Pilitin mang magsama'y may mahahapis
Ganyan-ganyan tayong dalawa
Ang panuntana'y magkaiba

Langis at tubig
'Di mapagsama ng tunay mang pag-ibig
Hinanakit ang siyang laging mananaig
Mahal na mahal man kita
May mahal ka namang iba

Tubig at langis
Idarang man sa init 'di rin tatamis
Dahil ang halo'y luha't paghihinagpis
Ang kirot ay 'di maalis
Kung labis...

Bakit nanaig
Ang dusa sa ligaya sa ating daigdig
May dasal ba akong hindi niya narinig
Papel natin sa pag-ibig
Ako'y langis ika'y tubig

Tubig at langis
Idarang man sa init 'di rin tatamis
Dahil ang halo'y luha't paghihinagpis
Ang kirot ya 'di maalis
Kung labis...

Bakit nanaig
Ang dusa sa ligaya sa ating daigdig
May dasal ba akong hindi niya narinig
Papel natin sa pag-ibig
Ako'y langis ika'y tubig...

Ako'y langis ika'y tubig...
"
"""Tunay Na Mahal""",Lani Misalucha,No Album,"

Di ba't ang pangako mo sa'kin
Ako lamang ang iibigin
Ngunit bakit ngayo'y hindi mo man lang mapansin
Twina sa 'king alaala
Ay palagi kitang kasama
Ngunit bakit ngayon ay may mahal ka ng iba

Nasan na ang pangako mo
Noong sinusuyo ako
Anong tamis, Anong lambing
Binibigkas ng labi mo
Ngunit kahit nagbago pa
Sa akin ang damdamin mo
Mananatili kang mahal sa puso ko

Halos di ko na makaya
Ang isipin kong wala na
Ang pagmamahal mo nga ba ay naglaho na
Patuloy na ako'y aasa
Kahit na sa alaala
Ang pag-ibig ko sayo'y hindi mag-iiba

Nasan na ang pangako mo
Noong sinusuyo ako
Anong tamis, Anong lambing
Binibigkas ng labi mo
Ngunit kahit nagbago pa
Sa akin ang damdamin mo
Mananatili kang mahal sa puso ko

Pagka't ikaw ang tunay na mahal
Kaya't hindi magbabago kailanpaman
Kahit na nga ako ay nasaktan

Nasan na ang pangako mo
Noong sinusuyo ako
Anong tamis, Anong lambing
Binibigkas ng labi mo
Ngunit kahit nagbago pa
Sa akin ang damdamin mo
Mananatili kang mahal sa puso ko

Ngunit kahit nagbago pa
Sa akin ang damdamin mo
Mananatili kang mahal sa puso ko

Ikaw ang mahal sa puso ko
"
"""Unbreakable""",Lani Misalucha,No Album,"

Cold nights, his hands are numb, my heart is frozen
Dark skies they hide behind my tears
Every day's an uphill battle, broken and confused
It's like I've lost and won
And I get so numb
But I'll just stand up and I'll say

I wanna be stronger
Let out my roar and tell the world that I'm wiser
Let go of my fears and hear me scream like ohh
I'd walk through the fire (fire)
You know I'm unbreakable

I'm gonna get stronger
(No you're never gonna stop me)
I'm gonna be stronger
(No you're never gonna stop me)
Unbreakable

I'm lying motionless in sorrow
And I keep running from the pain (running)
Even though my world's colliding
I'll crash and face my fears
Can anybody, anybody hear me?

I wanna be stronger
Let out my roar, and tell the world that I'm wiser
Let go of my fears and hear me scream like ohh
I'd walk through the fire (fire)
You know I'm unbreakable

Through the darkness comes the rain
In the shadows and I'm burning light
I'll never give up this fight

I wanna be stronger
Let out my roar and tell the world that I'm wiser
I wanna be stronger
Let out my roar and tell the world that I'm wiser
Let go of my fears and hear me scream like ohh
I'd walk through the fire, fire
You know I'm unbreakable

I'm gonna get stronger
(No you're never gonna stop me)
I'm gonna be stronger
(No you're never gonna stop me)

I'm gonna get stronger
(No you're never gonna stop me)
I'm gonna be stronger
(No you're never gonna stop me)
You know I'm unbreakable
"
"""When You Believe""",Lani Misalucha,No Album,"

Many nights we prayed
With no proof anyone could hear
In our hearts a hope for a song
We barely understood
Now we are not afraid
Although we know there's much to fear
We were moving mountains
Long before we knew we could

There can be miracles
When you believe
Though hope is frail
It's hard to kill
Who knows what miracles
You can achieve
When you believe
Somehow you will
You will when you believe

In this time of fear
When prayer so often proves in vain
Hope seems like the summer bird
Too swiftly flown away
Yet now I'm standing here
My heart's so full, I can't explain
Seeking faith and speaking words
I never thought I'd say

There can be miracles
When you believe
Though hope is frail
It's hard to kill
Who knows what miracles
You can achieve
When you believe
Somehow you will
You will when you believe

They don't always happen when you ask
And it's easy to give in to your fears
But when you're blinded by your pain
Can't see the way, get through the rain
A small, but still, resilient voice
Says hope is very near

There can be miracles
When you believe
Though hope is frail
It's hard to kill
Who knows what miracles
You can achieve
When you believe
Somehow you will
Somehow you will
You will when you believe
You will when you
You will when you believe
"
"""You Don't Have To Say You Love Me""",Lani Misalucha,No Album,"

When I said I needed you
You said you would always stay
It wasn't me who changed but you
And now you've gone away
Don't you see that now you've gone
And I'm left here on my own
That I have to follow you
And beg you to come home?

You don't have to say you love me
Just be close at hand
You don't have to stay forever
I will understand
Believe me, believe me
I can't help but love you
But believe me
I'll never tie you down

Left alone with just a memory
Life seems dead and so unreal
All that's left is loneliness
There's nothing left to feel

You don't have to say you love me
Just be close at hand
You don't have to stay forever
I will understand
Believe me, believe me
You don't have to say you love me
Just be close at hand
You don't have to stay forever
I will understand

Believe me, believe me, believe me
"
"""Alphabet Song""",Lea Salonga,"""Small Voice""","

'a' - you're adorable
'b' - you're so beautiful
'c' - you're so cute and full of charm
'd' - you're a darling
'e' - you're exciting
'f' - you're a feather in my arms
'g' - you're so good to me
'h' - you're so heavenly
'i' - you're the 'i' that idolize
'j' - we're like jack and jill
'k' - you're so kissable
'l' - you're the lovelife in my eye
'm','n','o','p' I could go on all day
'q','r','s','t' alphabetically speaking, you're okay
'u' - make my life complete
'v' - makes you very sweet
'w','x','y','z'

It's fun to wander through the alphabet with you
To tell you what it means to me

[repeat all]
"
