Song,Artist,Album,Lyrics
"""Getting To Know Each Other""",Ariel Rivera,No Album,"

I call you and you call me
It's funny how we get on so easily
We're just friends, aren't we?
You've got yours, I've got mine
And friends are all we ever could be

But we're getting to know each other a little too well
We're starting to show our feelings and people can tell
Every time that your eyes meet mine
I light up like a neon sign
Yes, we're getting to know each other a little too well

We have lunch every now and then
And I find myself humming love song again and again
Too many nights I'm working 'till ten
And I hope that you know that it's hopeless to go on when

We're getting to know each other a little too well
We're starting to show our feelings and people can tell
Every time that your eyes meet mine
I light up like a neon sign
Yes, we're getting to know each other
Getting to know each other
Getting to know each other
A little too well
Getting to know each other a little too well
"
"""Give Our Love Today""",Ariel Rivera,No Album,"

So many nights, I've been waiting for this night
I have been longing for you
'Cause you promise to give your love to me tonight
But after the night
I'll be wondering what it's like
To be out there
Singing in the cold of the night
Kids are wanting to be loved

Give love on Christmas day
Let's give your love today
Give love on this special day
Let's give them love today
Give love in a special way
Let's give our love today

Starting today, I think it's always Christmas day
You won't believe it 'cause things will start to change
Let the world be filled with joy each day

Give love on Christmas day
Let's give your love today
Give love on this special day
Let's give them love today
Give love in a special way
Let's give our love today

Give our love (Give our love)
Give our love today (Give our love)
Today
"
"""Habang Buhay Ay Ikaw""",Ariel Rivera,No Album,"

Habang buhay mamahalin ay ikaw
Ikaw ang hinanap, tinatawag
Maging gabi't araw

At di nagtagal pag-ibig mo'y nakamtan
Sana'y habang buhay ang alay mo
Sa aking pagmamahal

Habang buhay mamahalin ay ikaw
Ikaw ang ligaya, aking pag-asa
Habang buhay
Kailanpaman di ka mawawalay
Sa aking isipan, aking damdamin
Habang buhay

Bakit kaya kahit mayrong iba
Sa aki'y pumapansin, tumitingin
At nag-aalala

Di magawang dayain ang pagsinta
Dahil walang ibang minamahal
At iibigin pa

Dahil kung
Ang mabuha
Walang nagmamahal

Habang buhay mamahalin ay ikaw
Ikaw ang ligaya, aking pag-asa
Habang buhay
Kailanpaman di ka mawawalay
Sa aking isipan, aking damdamin
Habang buhay

Sa aking isipan, aking damdamin
Habang buhay
"
"""Maari Ba""",Ariel Rivera,No Album,"

Hindi ko alam ang gagawin ko
Sa tuwing ika'y nagdaraan
Lagi akong kinakabahan
Hindi ko alam ang gagawin ko
Tibok ng puso'y naghahabulan
Kapag ikaw ay pinagmamasdan
Giliw, kung batid mo lang
Ang naramdaman nung araw na kita'y makita
Laging nasa isip ka
Di malimot ang kislap ng 'yong mga mata

Hindi ko alam ang gagawin ko
Lalapit ba ako sa'yo
O hihintayin ko ang lingon mo
Hindi ko alam ang gagawin ko
Baka ako'y iwasan mo
Magtago na lang kaya ako
Giliw, kung batid mo lang
Ang naramdaman nung araw na ika'y makita
Laging nasa isip ka
Di malimot ang kislap ng 'yong mga mata
Maa'ri bang makasama ka
At magmahalan tayong dal'wa magpakailanman
Maa'ri bang makapiling ka
At mag-ibigan tayong dal'wa magpakailanman
Maa'ri ba

Hindi ko alam ang gagawin ko
Sa tuwing ikaw'y nagdaraan
Lagi akong kinakabahan
Hindi ko alam ang gagawin ko
Tibok ng puso'y naghahabulan
Kapag ikaw ay pinagmamasdan
Giliw, kung batid mo lang
Ang naramdaman nung araw na ika'y makita
Laging nasa isip ka
Di malimot ang kislap ng 'yong mga mata
Maa'ri bang makasama ka
At magmahalan tayong dal'wa magpakailanman
Maa'ri bang makapiling ka
At mag-ibigan tayong dal'wa magpakailanman
Maa'ri ba

Maa'ri bang makasama ka
At magmahalan tayong dal'wa magpakailanman
Maa'ri bang magpakailanman

Maa'ri ba...
"
"""Mahal Na Mahal Kita""",Ariel Rivera,No Album,"

Puso ko, kahit hindi tulungan
Alaala ka bawat sandali
Kapag kapiling ko'y nangingiti
O, mahal ko

At kung malayo ka
Lungkot ang nadarama
Araw-araw ay di mapakali
Dibdib kumakaba

Mahal na mahal kita
Oh baby, mahal na mahal kita
Wala nang iba pa
Kungdi ikaw lamang, tanging ikaw lamang

At kung ikaw sa akin ay mawawala
Paano na ang gagawin
Makaya pa kaya ang tiisin, hapdi ng puso
Pinapangako ko, ikaw lang ang pag-ibig ko
At iyan ay di magbabago
Hanggang sa dulo ng mundo

Mahal na mahl kita
Oh baby, mahal na mahal kita
Wala ng iba pa
Kungdi ikaw lamang, tanging ikaw lamang
...sumpa ko sa iyo

Mahal na mahl kita
Oh baby, mahal na mahal kita
Wala ng iba pa
Kungdi ikaw lamang, tanging ikaw lamang
...sumpa ko sa iyo
"
"""Minsan Lang Kitang Iibigin""",Ariel Rivera,No Album,"

Mahal, pangako sa iyo
Hindi magbabago
Ikaw lang ang iibigin ko
Kahit Ikaw ay lumayo
At masaktan ako
Asahan na 'di maglalaho

Ang pag-ibig ko'y tanging sa'yo lamang
Kung kaya giliw dapat mong malaman

Minsan lang kitang iibigin
Minsan lang kitang mamahalin
Ang pagmamahal sa'yo'y walang hangganan
Dahil ang minsan, ay magpakailanman

Minsan lamang sa buhay ko
Ang 'sang katulad mo
Ako rin ba'y iniibig mo
Dinggin puso'y sumasamo
Sinusumpa sa'yo
Ikaw ang tanging dalangin ko

Ang pag-ibig ko'y tanging sa'yo lamang
Kung kaya giliw dapat mong malaman

Minsan lang kitang iibigin
Minsan lang kitang mamahalin
Ang pagmamahal sa'yo'y walang hangganan
Dahil ang minsan, ay magpakailanman

Minsan lang kitang iibigin
Minsan lang kitang mamahalin
Ang pagmamahal sa'yo'y walang hangganan
Dahil ang minsan, ay magpakailanman
Dahil ang minsan, ay magpakailanman
"
"""One More Gift""",Ariel Rivera,No Album,"

If there's one more gift I'd ask of You, Lord
It would be peace here on Earth
As gentle as Your children's laughter
All around, all around

Your people have grown weary
Of living in confusion
When will we realize that neither heaven is at peace
When we live not in peace?

If there's one more gift I'd ask of You, Lord
It would be peace here on Earth
As gentle as Your children's laughter
All around, all around

Grant me serenity within
For the confusions around
Are mere reflections of what's within
What's within me

If there's one more gift I'd ask of You, Lord
It would be peace here on Earth
As gentle as Your children's laughter
All around, all around

Lord, grant us peace
As gentle as Your children's laughter
All around
Do-do-do, do-do-do-do
If there's one more gift I'd ask of You, Lord
"
"""Photograph""",Ariel Rivera,No Album,"

I still have a photograph of you
I've keep it all these years
I guess it would make you laugh to know
It still bring back the tears

From another place and time
When your love was mine

A picture of innocence, your eyes
They move me even now
If I had the confidence I'd try
To bring you back somehow

To another place and time
When your love was mine

Maybe I'm just
A sentimental fool
Bringing back memories
From a photograph of you

Back to another place and time
When your love was mine

Maybe I'm just
A sentimental fool
Bringing back memories
From a photograph of you

I still have a photograph of you
I've keep it all these years
"
"""Sa Aking Puso""",Ariel Rivera,No Album,"

Uulit-ulitin ko sa 'yo
Ang nadarama ng aking puso
Ang damdamin ko'y para lang sa 'yo
Kahit kailanma'y hindi magbabago

Ikaw ang laging hanap hanap sa gabi't araw
Ikaw ang nais kong sa tuwina ay natatanaw
Ikaw ang buhay at pag-ibig wala na ngang iba
Sa 'king puso'y tunay kang nag-iisa

'Di ko nais na mawalay ka
Kahit sandali sa aking piling
Kahit buksan pa ang dibdib ko
Matatagpua'y larawan mo

Ikaw ang laging hanap hanap sa gabi't araw
Ikaw ang nais kong sa tuwina ay natatanaw
Ikaw ang buhay at pag-ibig wala na ngang iba
Sa 'king puso'y tunay kang nag-iisa

Kahit buksan pa ang dibdib ko
Matatagpua'y larawan mo

Ikaw ang laging hanap hanap sa gabi't araw
Ikaw ang nais kong sa tuwina ay natatanaw
Ikaw ang buhay at pag-ibig wala na ngang iba
Sa 'king puso'y tunay kang nag-iisa

Ikaw ang laging hanap hanap sa gabi't araw
Ikaw ang nais kong sa tuwina ay natatanaw
Ikaw ang buhay at pag-ibig wala na ngang iba
Sa 'king puso'y tunay kang nag-iisa
Sa 'king puso'y tunay kang nag-iisa
"
"""Sana Kahit Minsan""",Ariel Rivera,No Album,"

Bakit ikaw ang nais na matanaw nitong mga mata
Tunay kayang nabighani ako sa taglay mong ganda
Nais kong marinig malamyos mong tinig
Na sa akiy aliw at tila ba itoy hulog pa ng langit

Pag nakita ka nay ayaw nang kumurap o pumikit man lang
Dahil baka mawala kang bigla nang hindi ko alam
Minsay hinahagkan, yakap-yakap kita
Ngunit sa paggising ko ay tila ba tunay at nanghihinayang na

Sana kahit minsan ay mapansin ako
Malaman kong ikay mahal at yan ang totoo
Huwag mong iisiping nagbibiro ako
Tunay ang pag-ibig na alay sa yo

Pag nakita ka nay ayaw nang kumurap o pumikit man lang
Dahil baka mawala kang bigla nang hindi ko alam
Minsay hinahagkan, yakap-yakap kita
Ngunit sa paggising ko ay tila ba tunay at nanghihinayang na

Sana kahit minsan ay mapansin ako
Malaman kong ikay mahal at yan ang totoo
Huwag mong iisiping nagbibiro ako
Tunay ang pag-ibig na alay sa yo

Hanap ng puso ay laging ikaw
Tanging nais ko ang yong pagmamahal
Sana sabihing mahal mo rin ako
Ikaw ang nais ng damdamin ko

Sana ay mapansin ako
Malaman mong kitay mahal at yan ang totoo
Huwag mong iisiping nagbibiro ako
Tunay ang pag-ibig na alay
Ikaw ang nais sa habang buhay
Ang pag-ibig na alay ko sa yo tunay
Sa yoy tunay
Sana kahit minsan... minsan
Sana kahit minsan...
Sana kahit minsan...
"
"""Simple Lang""",Ariel Rivera,No Album,"

Simple lang naman ang nais
Sa damdamin at sa isip
Hindi ba't kay sarap ng buhay
Kung simple ang dating

Simple lamang sa pag-ibig
Nang 'di laking gulo sa isip
Kailangan mong maging tapat
Ganyan kung umiibig

Simpleng buhay ay kay ganda
Mayroong ngiti
Mayroong saya
Walang hindi magagawa
Lalo na't simple ka
Sama-sama magkaisa
Kahit maging sino ka pa
Lahat ay 'di ba't kay dali
Ganyan ka lang sana

Simple lang naman ang nais
Sa damdamin at sa isip
Hindi ba't kay sarap ng buhay
Kung simple ang dating

Simple lamang sa pag-ibig
Nang 'di laking gulo sa isip
Kailangan mong maging tapat
Ganyan kung umiibig

Simpleng buhay ay kay ganda
Mayroong ngiti
Mayroong saya
Walang hindi magagawa
Lalo na't simple ka
Sama-sama magkaisa
Kahit maging sino ka pa
Lahat ay 'di ba't kay dali
Ganyan ka lang sana

Simpleng buhay ay kay ganda
Mayroong ngiti
Mayroong saya
Walang hindi magagawa
Lalo na't simple ka
Sama-sama magkaisa
Kahit maging sino ka pa
Lahat ay 'di ba't kay dali
Ganyan ka lang sana

Simpleng buhay ay kay ganda
Mayroong ngiti
Mayroong saya
Walang hindi magagawa
Lalo na't simple ka
Sama-sama magkaisa
Kahit maging sino ka pa
Lahat ay 'di ba't kay dali
Ganyan ka lang sana
"
"""Tunay Na Ligaya""",Ariel Rivera,No Album,"

'Di ko pansin ang kislap ng bituin
'Pag kapiling ka, sinta
Kahit liwanag ng buwan sa gabi
'Di ko na masisita
Iisa lang ang naghaharing tala sa mundo
Tanging ikaw ang liwanag sa buhay ko...

'Di ko pansin ang bango ng Jasmin
'Pag kapiling ka, sinta
Kahit ga-dagat ang dami ng rosas hindi matataranta
Iisa lang ang nagtataglay ng halimuyak
At ikaw nga, tanging ikaw, sinta

Ikaw ang tunay na ligaya
Tanging ikaw, sinta
Umaga, hapon kahit magdamag
Laging ikaw, sinta
Umaga, hapon, kahit magdamag
Laging ikaw, sinta
Hindi magsasawa sa piling mo
(Hooh...)

'Di ko pansin ang bawat sandali
'Pag kapiling ka, sinta
Bagyo't ulan, kidlat o kulog man
'Di ko napapansin, sinta
Iisa lamang ang hinihiling kong kasagutan
Ang ngayon at kailanma'y makapiling ka

(Ikaw ang tunay na ligaya)
(Tanging ikaw, sinta)
Tanging ikaw...
(Umaga, hapon, kahit magdamag)
(Laging ikaw, sinta)
Hindi magsasawa sa piling mo
(Ikaw ang tunay na ligaya)
(Tanging ikaw, sinta)
Tanging ikaw...
(Umaga, hapon, kahit magdamag)
(Laging ikaw, sinta)
Hindi magsasawa sa piling mo...
"
"""Wala Kang Katulad""",Ariel Rivera,No Album,"

Mula ng kita'y makilala
Walang ibang naaalala
Kundi ang tamis ng iyong ngiti
Parang nagsasabing, mahal mo ako

Ibang-iba ka aking giliw
Sa lahat ng nakilala
Walang ibang naghahatid ng sigla, tulad mo sinta

Wala kang katulad, wala ng hihigit pa sa iyo
Wala kang kaparis, wala ng gaganda pa sa iyo
'Di ka maihahambing
Kahit kanino pa, labis ang 'yong ganda
Wala kang katulad, at mahal kita

Iisa lamang ang nais
Ang makapiling kang lagi
At pagmasdan ang iyong nangungusap na mga mata
O kay ganda

Lagi akong umaasang
habang buhay tayong magsasama
'Wag kang mabahalsa sa piling ko ay liligaya ka

Wala kang katulad, wala ng hihigit pa sa iyo
Wala kang kaparis, wala ng gaganda pa sa iyo
'Di ka maihahambing
Kahit kanino pa, labis ang 'yong ganda
Wala kang katulad, at mahal kita

Minsan pa lamang sa aking buhay
Nakadama ng ganito, oh

Wala kang katulad, wala ng hihigit pa sa iyo
Wala kang kaparis, wala ng gaganda pa sa iyo
'Di ka maihahambing
Kahit kanino pa, labis ang 'yong ganda
Wala kang katulad
Wala kang katulad
Wala kang katulad
At mahal kita
At mahal kita
"
"""Without Your Love""",Ariel Rivera,No Album,"

Only yesterday when we're together
I never thought your love for me would fade away
I was so sure that this would last forever
Is there a thing that I should do to make you stay?
'Cause baby

Living is empty without your love
Running away with all my heart
Baby, I'm not used to being far away from you 'cause
Living is empty without your love
Honey, you're tearing me apart
If tomorrow doesn't bring you back again
I'll wait till then

Yes, there's still a chance to talk it over
Baby, oh please just let me hold you once again
Let us forget the past and make it better
Can we go back to where we started way back then?
'Cause baby

Living is empty without your love
Running away with all my heart
Baby, I'm not used to being far away from you 'cause
Living is empty without your love
Honey, you're tearing me apart
If tomorrow doesn't bring you back again
I'll wait till then
'Cause I can't live without your love

I won't forget the times we've had
I see your face just everywhere
I know my heart keeps saying I love you, again
'Cause baby
'Cause baby

Living is empty without your love
Running away with all my heart
Baby, I'm not used to being far away from you 'cause
Living is empty without your love
Honey, you're tearing me apart
If tomorrow doesn't bring you back again
I'll wait till then
'Cause I can't live without your love
I can't live without your love
"
"""Little Star""",Aiza Seguerra,"""Little Star""","

Little star, little star
My one dream is to be where you are
The people, they laughed at me
Oh, why can't they let me be
One day I know they'll see
I am not them, I'm me

Last night a little star
Smiled at me from afar
Looking down from up above
Shining starlight filled with love
Daylight it came so fast
And the night it came to pass
Even stars may fade away
But my little friend please stay
Little star, little star
My one dream is to be where you are

Little star, little star
My one dream is to be where you are
The people, they laughed at me
Oh, why can't they let me be
One day I know they'll see
I am not them, I'm me

Last night a little star
Smiled at me from afar
Looking down from up above
Shining starlight filled with love
Daylight it came so fast
And the night it came to pass
Even stars may fade away
But my little friend please stay
Little star, little star
My one dream is to be where you are
My one dream is to be where you are
"
"""Pagdating Ng Panahon""",Aiza Seguerra,"""Pagdating Ng Panahon""","

Alam kong hindi mo pansin
Narito lang ako
Naghihintay na mahalin
Umaasa kahit di man ngayon
Mapapansin mo rin
Mapapansin mo rin

Alam kong di mo makita
Narito lang ako
Hinihintay lagi kita
Umaasa kahit di man ngayon
Hahanapin mo rin hahanapin din

Pagdating ng panahon
Baka ikaw rin at ako
Baka tibok ng puso ko'y
Maging tibok ng puso mo
Sana nga'y mangyari 'yon
Kahit di pa lang ngayon
Sana ay mahalin mo rin
Pagdating ng panahon

Alam kong hindi mo alam
Narito lang ako
Maghihintay kahit kailan
Nangangarap kahit di man ngayon
Mamahalin mo rin
Mamahalin mo rin

Pagdating ng panahon
Baka ikaw rin at ako
Baka tibok ng puso ko'y
Maging tibok ng puso mo
Sana nga'y mangyari 'yon
Kahit di pa lang ngayon
Sana ay mahalin mo rin
Pagdating ng panahon

Di pa siguro bukas
Di pa rin ngayon
Malay mo balang araw
Dumating din iyon

Pagdating ng panahon
Baka ikaw rin at ako
Baka tibok ng puso ko'y
Maging tibok ng puso mo
Sana nga'y mangyari 'yon
Kahit di pa lang ngayon
Sana ay mahalin mo rin
Pagdating ng panahon
"
"""If We Try""",Aiza Seguerra,"""Pagdating Ng Panahon""","

When I see you on the street
I lose my concentration
Just the thought that we might meet
Creates anticipation

Won't you look my way once before you go
And my eyes will say what you ought to know

Well, I've been thinkin' about you day and night
And I don't know if it'll work out right
But somehow I think that it just might
If we try

Faces come and faces go
In circular rotation
But something yearns within to grow
Beyond infatuation

Won't you look my way once before you go
And my eyes will say what you ought to know

Well, you've got me standin' deaf and blind
'Cause I see love as just a state of mind
And who knows what it is that we might find
If we try
And who knows what it is that we might find
If we try

You've walkin' a diff'rent direction
From most people I've met
You've givin' me signs of affection
I don't usually get
I don't want you to pledge your future
The future's not yours to give
Just stand there a little longer
And let me watch you while you leave

'Cause when I see you on the street
I lose my concentration
And just the thought that we might meet
Creates anticipation

Won't you look my way once before you go
And my eyes will say what you ought to know

Well, I've been thinkin' about you day and night
And I don't know if it'll work out right
But somehow I think that it just might
If we try
Somehow I think that it just might
If we try
Yes, somehow I think that it just might
If we try
"
"""In My Life Medley""",Aiza Seguerra,"""Pagdating Ng Panahon""","

There are places I remember
All my life
Though some have changed
Some forever not for better
Some have gone
And some remain

Though I know I'll never ever lose affection
For people and things that went before
I know I'll often stop and think about them
In my life
I loved you more

Though the music is sweet
But the song ain't complete
Now in my life
Boy, in my life
Somethin' is missing
It's a tune, yes it's true
Still there's no me and you
Here in my life
Boy, in my life
Somethin' is missing

In my life
There ain't no melody, oh no
In my life
There ain't no harmony
To help me sing a song

Oh the music is sweet
(There are places I remember)
But the song ain't complete
Now in my life
(All my life)
Somethin' is missing
(Though some have changed)
It's a tune, yes it's true
(Some forever, not for better)
Still there's no me and you
(And some have gone)
Here in my life
Somethin' is missing
(And some remain)

In my life there ain't no melody oh no
(All these places have their moments)
(With lovers and friends)
(I still can recall)
In my life there ain't no harmony
(Some are dead and some are living)
To help me sing this song
(In my life)
(I loved them all)

All I need is a cue
Well, I'm waiting for you
Here in my life
(But of all these friends and lovers)
Boy in my life
(There is no one compares with you)
You are the melody (melody)
'Cause in my life
(In my life)
I know I'll often stop and think about them
You are the song
(I loved you more)
You are the melody to me, baby
You are the song
"
"""I See You Lord""",Aiza Seguerra,"""Pagdating Ng Panahon""","

I'm so blessed my Lord
I can see you
In all the lovely things
So fine and true
I see you in the beauty
Of the flowers and the rain
I see you between the lines
Of a sweet refrain

I'm so blessed my Lord
I can see you
Even when I'm lonely and in pain
I see you in the beauty of the stars at night
I see you in my life
I feel alright

I see you Lord
In sorrow and in happiness
I see you in the glory
Of sweet success
I see you Lord
Every hour, everyday
I can see you Lord
Whenever I pray

I'm so blessed my Lord
I can see you
In the smile of a baby
Sweet and true
I can see you in the eyes
Of my very best friends
I see you in these bonds
Just like your love that never ends

I see you Lord
In sorrow and in happiness
I see you in the glory
Of sweet success
I see you Lord
Every hour, everyday
I can see you Lord
Whenever I pray

I see you Lord
In sorrow and in happiness
I see you in the glory
Of sweet success
I see you Lord
Every hour, everyday
I can see you Lord
Whenever I pray
I pray...
I can see you Lord
Whenever I pray...
I see you Lord...
"
"""Put A Little Love In Your Heart""",Aiza Seguerra,"""Pagdating Ng Panahon""","

Think of your fellowmen
Lend them a helping hand
Put a little love in your heart
That's right now, baby
You see it's getting late
Oh please don't hesitate
Put a little love in your heart

And the world will be a better place
And the world will be a better place
For you and me
You just wait and see

Another day goes by
Still the children cry
Put a little love in your heart
If you want the world to know
We won't let hatred grow
Put a little love in your heart

And the world will be a better place
And the world will be a better place
For you and me
You just wait and see
Yeah yeah yeah...

Put a little love...
Put a little love...
In your heart
Put a little love in your heart
Put a little love in your heart

Take a good look around
And if you're looking down
Put a little love in your heart
I hope when you decide
Kindness will be your guide
Put a little love in your heart

And the world will be a better place
And the world will be a better place
For you and me
You just wait and see
Yeah yeah yeah...

Put a little love
Put a little love in your heart
That's right now, baby
Put a little love in your heart
Put a little love in your heart
Love in your heart
...

And the world will be a better place
And the world will be a better place
For you and me
You just wait and see
Yeah yeah yeah...

Put a little love in your heart...
Help me out!...

Think of your fellowmen
Lend them a helping hand
Put a little love in your heart
...
"
"""Take Me I'll Follow""",Aiza Seguerra,"""Pagdating Ng Panahon""","

Tired of feeling all by myself
Being so different from everyone else
Somehow you knew I needed your help
Be my friend forever
I never found my star in the night
Building my dream was far from my sight
You came along and I saw the light
We'll be friends forever

I can't face the thought of you leaving
So take me along
I swear I'll be strong

If you take me wherever you go
I wanna learn the things that you know
Now that you made me believe
I want you to take me
'Cause I long to be
Able to see the things that you see
Know that whenever you do
I'll follow you

Somebody must have sent you to me
What do I have you could possibly need
All I can give is my guarantee
We'll be friends forever

I can't face the thought of you leaving
So take me along
I swear I'll be strong

When you take me wherever you go
I wanna learn the things that you know
Now that you made me believe
I want you to take me
'Cause I long to be
Able to see the things that you see
Know that whenever you do
I'll follow you

Teach me more with each passing hour
By your side
I'll follow you
I know I would cover?
Is it true that you have the power
To capture this moment in time

Take me wherever you go
I wanna learn the things that you know
Now that you made me believe
I want you to take me
'Cause I long to be
Able to see the things that you see
Know that whenever you do
I'll follow you

Take me wherever you go
I wanna learn the things that you know
Now that you made me believe
(I want you to take me...)
I want you to take me...
"
"""If""",Aiza Seguerra,"""Pagdating Ng Panahon""","

If a picture paints a thousand words
Then why can't I paint you
The words will never show
The you I've come to know
If a face could launch a thousand ships
Then where am I to go
There's no one home but you
You're all that's left me too

And when my love
For life is running dry
You'll come and pour yourself on me

If a man could be two places
At one time I'd be with you
Tomorrow and today
Beside you all the way
If the world should start revolving
Spinning slowly down to die
I'd spend the end with you
And when the world was through

Then one by one
The stars would all go out
Then you and I would simply fly away
"
"""The Right One""",Aiza Seguerra,"""Pagdating Ng Panahon""","

It's not the laughter
It's not just the fun
You've always touched my heart
I know you're the one
You're nothing less than a perfect friend to me
Don't try to be like anyone else
You don't have to be

It's not the hours
The times that we've spent
A special moment like this
Makes you know it's heaven sent
You're nothing less than the right one for me
Don't try to be like someone else
You don't have to be

You're the right one
The right one for me
We can be friends for life
Good friends we'll always be
No matter where life leads us
We'll always have each other
'Cause you're the right one
The right one for me

It's not the sweet song
It isn't the dream
It's just you my good friend
And the love that you bring
Throughout the seasons
You're the one for me
You're the one I love to love
And you'll always be

You're the right one
The right one for me
We can be friends for life
Good friends we'll always be
No matter where life leads us
We'll always have each other
'Cause you're the right one
The right one for me
...

You're the right one
The right one for me
We can be friends for life
Good friends we'll always be
No matter where life leads us
We'll always have each other
'Cause you're the right one
The right one for me
(No matter where life leads us
We'll always have each other)
'Cause you're the right one
The right one for me
(It's not the laughter
It's not just the fun
You've always touched my heart)
"
