Song,Artist,Album,Lyrics
"""Espasyo""",Dong Abay,"""Flipino""","

Kwento-kwenta, Kwento-kwenta
Kwento-kwenta, Tila kanta

Kwento-kwenta, Kwento-kwenta
Kwento-kwenta, Binibenta

Sa paglapag ng sombrero
Makakapagsulat ako ng alamat
Bigyan lang ako ng espasyo
Bigyan lang ako ng espasyo

Aking kwento ay buhay ko at buhay mo
Aking kwento buhay pilipino,
Buhay pilipino

Kwento-kwenta, Kwento-kwenta
Kwento-kwenta, Tila kanta

Kwento-kwenta, Kwento-kwenta
Kwento-kwenta, Binibenta

Hindi ka pa kuntento
Hindi ka pa kuntento
Hindi ka pa kuntento

Sa eksperimento
Akala mo'y may kwenta
Pero wala pala

Hindi ka pa kuntento
Hindi ka na nasanay
Hindi ka na nasanay
Hindi ka na nasanay
Sa pagbabagong buhay
Akala mo may kwenta pero wala pala

Hindi ka na nasanay
Kailan ka matututo?
Kailan ka matututo?
Kailan ka matututo?
Sa pinaggagagawa mo
Akala mo'y may kwenta pero wala pala...

Hindi ka pa kuntento
Hindi ka na nasanay
Kailan ka matututo
Sa paglapag ng sombrero
"
"""Akrostik""",Dong Abay,"""Flipino""","

D - Di ako si Bamboo, Chito Parokya, Rico Rivermaya
O - O kaya naman sina Basti, Kevin Roy, Wency, Karl Roy
N - Noel Cabangon, Chikoy Pura, Pendong, Joey Ayala
G - Gary Granada, Ka Freddie, Mike Hanopol, Ely Buendia

A - At lalong di ako si Pepe, Florante, Yoyoy Villame, Heber Bartolome
B - Bobby Balingit, Binky Lampano, Jack Sikat, Jett Pangan, Jun Lopito, Jess Santiago, Pol Galang, Popong Landero
A - Alexander Cynthia, Coritha, Lolita, Sampaguita, Bayang Barrios, Susan Fernandez, Grace Nono, Cooky Chua
Y - Yan o, yan o, yan ako, ako ay sino ba?
Yan o, yan o, yan ako, ako ay sino ba?
Yan o, yan o, yan ako, ako ay sino ba?
Yan o, yan o, yan ako, ako ay sino ba?
"
"""Aba-Aba""",Dong Abay,"""Flipino""","

Kasalanan ko kung bakit ka nagkaganyan
Kasalanan kong aba abang kalagayan

Ako'y hindi marunong lumingon sa pinanggalingan
Kaya walang mararating walang paroroonan

Ako'y laging naglalakad nang napakatulin
Kaya ako'y matitinik nang napakalalim

Kasalanan ko kung bakit ka nagkaganyan
Bakit ka aba aba ang kalagayan

Kasalanan ko kung bakit ka nagkaganyan
Kasalanan ko aba abang kalagayan

Ang kapalaran ko'y hindi ko hahanapin
Kaya't di dudulog lalapit ang talagang sa akin

Ako'y hindi naghahangad ng anumang kagitna
Kaya ni isang salop walang mawawala

Kasalanan ko kung bakit ka nagkaganyan
Bakit ka aba aba ang kalagayan

Kasalanan ko kung bakit ka nagkaganyan
Kasalanan ko aba abang kalagayan

Kasalanan ko kung bakit ka nagkaganyan
Bakit ka aba aba ang kalagayan

Kasalanan ko kung bakit ka nagkaganyan
Kasalanan ko aba abang kalagayan
"
"""Perpekto""",Dong Abay,"""Flipino""","

Ikaw ay nagdaramdam
Puso ay nagdurugo
Hindi mo yata alam
Kung san ka patungo
Ikaw ay naliligaw
Isip ay nalilito
Ayaw mo ng gumalaw
Hindi ka sigurado

Ikaw ay napupuwing
Minsan nabubulagan
Mata ay nakapiring
Daan ay kadiliman
Ikaw ay nadadapa
Napipilayan din
Di makapagsalita
Anung ibig sabihin?

Wala, wala namang...
Wala namang perpektong tao

Ano ba ang epekto
Kung meron kang depekto?
Ano ba ang epekto
Kung meron kang depekto?
Ano ba ang epekto
Kung meron kang depekto?
Ano ba ang epekto
Kung meron kang depekto?

Ikaw ay nawawala
Minsan ay nawawalan
Di ka naniniwala
Puno ng alinlangan
Ikaw ay nanliliit
Ligtas ka ba sa rehas
Bakit ka nakapiit?
Bakit ka tumatakas?

Ikaw ay natatakot
Parang walang hangganan
Ang kirot ng bangungot
Di mo makalimutan
Ikaw ay nanlulumo
Bilang na ba ang araw?
Gusto mo ng sumuko
Mundo ay nagugunaw

Wala, wala namang...
Wala namang perpektong tao

Ano ba ang epekto
Kung meron kang depekto?
Ano ba ang epekto
Kung meron kang depekto?
Ano ba ang epekto
Kung meron kang depekto?
Ano ba ang epekto
Kung meron kang depekto?

Ikaw ay inaalon
Walang kalaban-laban
Tuluyang nalulunod
Tungo sa kalaliman
Ikaw ay nalulula
Agad kang nahuhulog
Babagsak sa lupa
At biglang madudurog

Ikaw ay nagdurusa
Kaya pa bang tumagal
Hindi na makahinga
Lalo pang nasasakal
Ikaw ay dumadaing
Dala mo ba ay sumpa
Para kang ililibing
At ipinagluluksa

Wala, wala namang...
Wala namang perpektong tao

Ano ba ang epekto
Kung meron kang depekto?
Ano ba ang epekto
Kung meron kang depekto?
Ano ba ang epekto
Kung meron kang depekto?
Ano ba ang epekto
Kung meron kang depekto?

Wala...
Wala namang...
Wala namang perpekto
Anu ba ang epekto
Kung meron kang depekto?
Wala namang perpektong tao...
"
"""Kukote""",Dong Abay,"""Flipino""","

May araw na o laging gabi
Sa mata ng aking kukote
Sa mata ng ating kukote
Gaano man kadilim
Magliliwanag pa rin

Nakikita ba ang bahagharing itim?
Ang buwan na bulok, ang basag na bituin
Naririnig din sa buong papawirin
Bihag ang kulog, kidlat ay alipin

May ulap na, may gubat, may dagat pa
Sa mata ng aking kukote
Sa mata ng ating kukote
Langit ay liliparin
Kahit ang hangin ay may patalim

Punong taimtim ay lilim ng lagim
Pusod ay puntod, puso ay balong malalim
Pagsisid ny hindi pinagsisisihan
Paligid ay isang panaginip lang

Umaambon, umuulan, bumabagyo
Sa mata ng aking kukote
Sa mata ng ating kukote
Umiiyak ang Diyos
Sa halakhak pagkatapos

Nabasa ka kaya sa patak na bumuhos?
Bumaha ba ng luha sa pagpalakpak ng unos?
Lumubog man ang lupa, may ilog parin na aagos
Malaya ay malawak, malaya at di nakagapos

Sa mata ng ating kukote
Sa mata ng aking kukote
Sa mata ng ating kukote
Sa mata ng aking kukote
Sa mata ng ating kukote
Sa mata ng aking kukote
Sa mata ng ating kukote
"
"""Awit Ng Kambing""",Dong Abay,"""Flipino""","

Halikayo magsilapit
Kahit na po ilang saglit
Pakinggan nyo itong awit
Na di na mauulit

Pero wag pong magagalit
Sa mga iguguhit
Ang hagupit na sinapit
Mapait masakit malupit

Si Juan ay seaman na nagbalik-bayan
Pagkatapos ng siyam na buwan
Inabutan sa tahanan
Matalik na kaibigan
Katalik ng kanyang asawa
Naghahalikan pa sila
Si Juan ay napamura
""Sa impyerno kayo magsama!""
Di nakapagpigil, gigil na gigil
Walang tigil pinagbabaril
Sa bandang huli
Sarili ang kinitil

Trahehehehehehehehehehehehehdya
Trahehehehehehehehehehehehehdya

Halikayo magsilapit
Kahit na po ilang saglit
Pakinggan nyo itong awit
Na di na mauulit

Pero wag pong magagalit
Sa mga iguguhit
Ang hagupit na sinapit
Mapait masakit malupit

Si Nene ginagahasa
Mula pagkabata ng ama-amahang siga
Nung isang gabi pinagtangkaan
Uli siyang pagsamantalahan
""Ayoko ko na, di ko na kaya""
Kaya si Nene ay nanlaban
Hayop na hayok
Tinaga ng gulok
Binuhusan ng gas
Saka sinilaban
Isa si Nene
Sa nasunog sa looban

Trahehehehehehehehehehehehehdya
Trahehehehehehehehehehehehehdya

Trahehehehehehehehehehehehehdya
Trahehehehehehehehehehehehehdya
Trahehehehehehehehehehehehehdya
Trahehehehehehehehehehehehehdya
"
"""Tuyo""",Dong Abay,"""Flipino""","

Ok lang kung tuyo na ang buhok
Tulog ka na kapag inaantok
Ok lang kung tuyo na ang batok
Punas pawis para di amoy putok
Ok lang kung tuyo na ang mata
Tapos na yatang umiyak di ba?
Ok lang kung tuyo na ang paa
Di ka na magkakaalipunga

Pero ano kung tuyo na ang dugo
Kahit tiyan may di na kukulo
Ano kung tuyo na ang puso
Baka maglaho ang pagsuyo

Dehins ok!
Dehins ok!
Dehins ok!
Dehins ok!

Ok lang kung tuyo na ang laway
Magmumog ka muna bago magsuklay
Ok lang kung tuyo ng sinampay
May masusuot ka na mamaya sa lamay
Ok lang kung tuyo na ang sulat
Ang tinta e di na babakat
Ok lang kung tuyo na ang sugat
Wag ka lang magkakapeklat

Pero ano kung tuyo na ang gripo
Pa'no magsesepilyo sa lababo?
Ano kung tuyo na ang poso
Sa'n maglalaba ng bra ang lola mo?

Dehins ok!
Dehins ok!
Dehins ok!
Dehins ok!

Ok lang kung tuyo na ang ubas
May pulutan na tayong pasas
Ok lang kung tuyo na ang gatas
May palamang keso bukas
Ok lang kung tuyo na ang baka
May kakainin na tayong tapa
Ok lang kung tuyo na ang buwaya
May pabrika ng sinturon at bota

Pero ano kung tuyo na ang balon
Aasa ka na lang ba sa ambon
Ano kung tuyo na ang talon
Di na mag-eenjoy sa bakasyon
Ano kung tuyo na ang sapa
Mamamatay mga butete't palaka
Ano kung tuyo na ang lawa
Luluwa ang mga mata ng mga isda

Dehins ok!
Dehins ok!
Dehins ok!
Dehins ok!

Ok lang kung tuyo ang semento
Bawal ju-mingle sa pader na ito
Ok lang kung tuyo na ang espalto
Wala na ang swimming pool sa kanto
Ok lang kung tuyo na ang kable
Di ka na uli makukuryente
Ok lang kung tuyo ang kalye
Walang baha trapik na lang ang dyahe

Pero ano kung tuyo na ang gubat
Magugutom tayo nang nakahubad
Ano kung tuyo na ang dagat
Sa ibang planeta lumipat

Ok na ok
Ok na ok
Ok na ok
Ok na ok

Ok na ok
Ok na ok
Ok na ok
Ok na ok
"
"""Mateo Singko""",Dong Abay,"""Flipino""","

Nakakadena si Amor
Nakahawla ang dama de noche
Walang trabaho, bagong layang si Ador
Reklamador
Kungdi ang magbilang ng poste

Mahirap maging mahirap
Mahirap maging mahirap
Mahirap maging mahirap
Maging mahirap
Maging mahirap

Hahagulgol ang batang kulang sa sustansya
Malutong na magmumura
Ang bungangerang ina
Uumbagan sya ng asawang sugarol
Na wala namang dalang delehensya

Mahirap maging mahirap
Mahirap maging mahirap
Mahirap maging mahirap
Maging mahirap
Maging mahirap

Mahirap maging mahirap
Mahirap maging mahirap
Mahirap maging mahirap
Maging mahirap
Maging mahirap

Sa ngalan ng mga ama at ina
Kasama ang mga anak nila
Espirito ng mga santo at santa
Espirito ng mga santo at santa
Espirito ng mga santo at santa
Espirito ng mga santo at santa
Espirito ng mga santo at santa
Espirito ng mga santo at santa
Espirito ng mga santo at santa
Espirito ng mga santo at santa
Espirito ng mga santo at santa
Espirito ng mga santo at santa
"
"""Dyad""",Dong Abay,"""Flipino""","

Sa puso at damdamin hindi ka maglalaho
Lagi kang iisipin kahit nasa malayo
Wag sanang kalimutan kapag ako'y wala na
Na nagkasama minsan sa hirap at ginhawa

Ako ay nangangarap na lagi kang makita
Alam ko na mahirap mag-antay ng pag-asa
Makinig ka sana sa sasabihin ko
Ikaw ang alaala na maganda ang mundo

Para para para para para para sa iyo itong kantang ito
Sana sana sana sana sana sana makarating pa ako sa iyo
Para para para para para sa iyo

Ako ay nangangarap na lagi kang makita
Alam ko na mahirap mag-antay ng pag-asa
Makinig ka sana sa sasabihin ko
Ikaw ang alaala na masaya ang mundo

Para para para para para para sa iyo itong kantang ito
Sana sana sana sana sana sana makarating pa ako sa iyo
Para para para para para sa iyo

Para para para para para para sa iyo itong kantang ito
Sana sana sana sana sana sana makarating pa ako sa iyo

Para para para para para para sa iyo itong kantang ito
Sana sana sana sana sana sana makarating pa ako sa iyo
Makarating pa ako sa iyo
Para para para sa iyo
"
"""Bombardment""",Dong Abay,"""Flipino""","

Shoemart o Robinson, Bench o Jockey
Marlboro o Winston, Adidas o Nike
Smart o Globe, Coke o Pepsi
Tide o Surf, SMB o Asia Brewery

Shakeys o Pizza Hut, McDonalds o Jollibee
Dunkin o Mister Donut, Kenny o KFC
Nissin o Lucky Me, Mentos o Maxx Candy
555 o Century, Jack n Jill o Oishi

Red Bull o Lipovitan, Nido o Alaska
Datu Puti o Silver Swan, Purefoods o Magnolia
Nestle o Selecta, Del Monte o UFC
Swift o Argentina, Bokbokbok Knorr o Maggi

Joy Ultra o Axion, Comfort o Downy
Clusivol o Enervon, Kleenex o Softee
Safeguard o Zest, Green Cross o Family
Whisper o Modess, National o Ever Ready

Raid o Baygon, Absolute o Wilkins
Colgate o Close Up, Palmolive o Pantene
Pampers o EQ, Eye Mo o Visine
8 O'Clock o Tang, Milo o Ovaltine

Star o Inquirer, Kodak o Fuji
Metrobank o BPI, Samsung o Sony
Yamaha o Kawasaki, Caltex o Shell
Toyota o Mitsubishi, PLDT o Bayantel

ABS-CBN o GMA 7
ABS-CBN o GMA 7
ABS-CBN o GMA 7
ABS-CBN o GMA 7

Charo o Mel Tiangco, Bayani o Michael V
Eat Bulaga o Wowowee, MYX o MTV
Martin o Gary V., Christina o Britney
Ate Guy o Ate Vi, Viva o Mother Lily

Gloria o FPJ, Marcos o Cory
Bush o Bin Laden, NPA o AFP
Iglesia o Katoliko, La Salle o Ateneo
Tagalog o Cebuano, English o Filipino

ABS-CBN o GMA 7
ABS-CBN o GMA 7
ABS-CBN o GMA 7
ABS-CBN o GMA 7

Original o Pirated
"
"""Ay Buhay""",Dong Abay,"""Flipino""","

Tambay sa tulay
Ang matandang pilay
Akbay ang saklay
Mata'y matamlay
Ay buhay

Ngalay na ngalay
Kanyang kanang kamay
Panay ang antay
Grasyang ibigay ay buhay

Ay buhay siya'y parang isang lantang gulay
Walang humpay sa hanapbuhay
Ang lagay matirang matibay
Ang lagay matirang matibay ay buhay

Laway at kaway
Awa ang taglay
Sanay magpatangay
Ang nanlulupaypay
Ay buhay

Sabay ang sakay
Sa sanlaksang ingay
Lantay na lumbay
Latay sa malay
Ay buhay

Ay buhay siya'y parang isang lantang gulay
Walang humpay sa hanapbuhay
Ang lagay matirang matibay
Ang lagay matirang matibay ay buhay

Ay buhay siya'y parang isang lantang gulay
Walang humpay sa hanapbuhay
Ang lagay matirang matibay
Ang lagay matirang matibay ay buhay
"
"""Segundo""",Dong Abay,"""Flipino""","

Kung sa isang iglap, makalimutan ng Diyos
Na ako ay isang manikang basahan
At kanyang pagkalooban ng kapirasong buhay

Hindi ko sasabihin, lahat ng iniisip
Sa halip ay iisipin, lahat ng sasabihin

Itatangi ko ang bawat bagay bagay
Hindi dahil lamang sa kahalagahan nito
Kundi sa kung ano ang kahulugang totoo
Ako'y matutulog nang kaunti at mas mananaginip
Mauunawaan na sa bawat minutong pagpikit

Nawawalan tayo ng animnapung segundo ng liwanag
Liwanag
Liwanag
Liwanag

Maglalakad ako kung ang iba ay ayaw humakbang
Mananatiling gising kung ang iba ay maidlip
Makikinig ako kung may magsasalita
Kung ako ay may puso, isusulat ko ang poot sa yelo
At maghihintay sa pagsikat ng araw

Ang aking luha ang didilig sa rosas
Sa kanyang imik dadamhin ko ang kirot
At ang pulang halik ng kanyang talulot

Ipababatid sa lahat ng minamahal
Na minamahal ko silang lahat

Mabubuhay ako nang nagmamahal sa pag-ibig
Pag-ibig
Pag-ibig
Pag-ibig

Marami akong natutunan mula sa mga nilalang
Ngunit ang katotohanan, wala itong pakinabang
Kahit pa ingatan ko, sa loob ng maletang ito
Malungkot ko pa ring lilisanin ang mundo
"
"""Solb""",Dong Abay,"""Flipino""","

Ngayong gabi
Siya ang may ari ng syudad
Tulad ng dati
Parang hari kung maglakad
Nakapikit
Ikot pa ang lagalag
Umaawit
Sisinghot ang batang banaag

High na high sa highway
Solb na solb sa solvent

High na high
Solb na solb
Sa highway
Sa solvent

Nag iisa
Napaupo sa bangketa
Tumatawa
Dinuduro ang estatwa
Nagbibilang
Ng sasakyang nagdadaan
Nag-aabang
Kung ano ang wala naman

High na high sa highway
Solb na solb sa solvent

High na high
Solb na solb
Sa highway
Sa solvent

Naghahanap
Ng pagkain sa basura
Ang masarap
Sa paninging tira-tira

Nakahiga
At binabalot ng sakong sira
Batang gala
Plastic na supot ang dala
"
"""WWIII""",Dong Abay,"""Flipino""","

Bukas ba paggising ko tahimik na?
Walang gulo?
Walang gulo?

Kung kailan ang linaw ko ang labo mo
Ang labo mo naman, mundo
Ang labo mo naman, mundo

Walang tigil, walang tigil
Walang tigil, walang tigil, walang tigil, walang tigil
Gyera!
Sunud-sunod, sunud-sunod
Sunud-sunod, sunud-sunod, sunud-sunod, sunud-sunod
Gyera!

Bukas ba paggising ko tahimik na?
Walang gulo?
Walang gulo?

Kung kailan ang linaw ko ang labo mo
Ang labo mo naman, mundo
Ang labo mo naman, mundo

Walang hinto, walang hinto
Walang hinto, walang hinto, walang hinto, walang hinto
Gyera!
Tuluy-tuloy, tuluy-tuloy
Tuluy-tuloy, tuluy-tuloy, tuluy-tuloy, tuluy-tuloy
Gyera!

Bukas ba paggising ko tahimik na?
Walang gulo?
Walang gulo?

Kung kailan ang linaw ko ang labo mo
Ang labo mo naman, mundo
Ang labo mo naman, mundo

'Di pa tapos, 'di pa tapos
'Di pa tapos, 'di pa tapos, 'di pa tapos, 'di pa tapos
Gyera!
Walang yawa, walang yawa
Walang yawa, walang yawa, walang yawa, walang yawa
Gyera!

Bukas ba paggising ko tahimik na?
Walang gulo?
Walang gulo?
Kung kailan ang linaw ko ang labo mo
Ang labo mo naman, mundo
Ang labo mo naman, mundo

Bukas ba paggising ko tahimik na?
Walang gulo?
"
"""Wow!""",Donna Cruz,"""Donna""","

Dati rati hello kitty at nagbabad sa TV
Sa maghapon yan ang hilig ko noon
Patentiro bidang bida
Jumping rope man o karera
Ako ang laging nauuna
Inipon kong mga manyeka
Barbie doll ang paborito
At sinusuklay suklay ko pa ito
Ngunit ngayon bakit ganun
Mula ng makilala ka
Lahat ng hilig ko'y naging balewala

Bawat banggit ng iyong pangalan
Sa skwela o kwentuhan
Lumuluksong bigla ang puso ko
At kung ika'y nasasalubong
Parang ibig kong umurong
Namumutla at conscious pa ako
Umiiwas sa iyong pansin
Ngunit ito'y gusto ko rin
Para akong lumalakad sa hangin
At sa gabi bago matulog
Ay iniisip kita
Upang sa dream ko sana tayo mag kita

Wow! Aba baka ikaw na nga
Ang sinasabing pag ibig
Nakakaloko talaga
Oh how galing naman
Ng aking nararamdaman
Wow! Gowdgie
Type na rin
Wow!

Ito ay aking tinatago
Isang munting sekrito
Baka malaman pa ng parents ko
Mahirap na ang mabuking
Masermunan ayoko rin
Kaya't sa puso't isipan lang ito
Bsta makita lang kita
Ang araw ko okey na
Ewan ko ba bakit gustong gusto kita
Wala na ngang hihilingin
Kahit ano ano pa man
Basta't ang feeling kong ito'y ganun nalang

Wow! Aba baka ikaw na nga
Ang sinasabing pag ibig
Nakakaloko talaga
Oh how galing naman
Ng aking nararamdaman
Wow! Gowdgie
Type na rin
Wow!

Ito ay aking tinatago
Isang munting sekrito
Baka malaman pa ng parents ko
Mahirap na ang mabuking
Masermunan ayoko rin
Kaya't sa puso't isipan lang ito
Basta makita lang kita
Ang araw ko okey na
Ewan ko ba bakit gustong gusto kita
Wala na ngang hihilingin
Kahit ano ano pa man
Basta't ang feeling kong ito'y ganun nalang
Wala na ngang hihilingin
Kahit ano ano pa man
Basta't ang feeling kong ito'y ganun nalang
"
"""Boy (I Love You)""",Donna Cruz,"""Donna""","

Boy, ang awiting to'y sa'yo
Boy, sa'n ka man naroroon
Kabilang dito ang damdamin nakatago
Na'di ko kayang banggitin sa'yo
Di'ka nawawala sa aking ala-ala
Maging araw at gabi iniisip kita lagi
Hello boy
Hello boy
Mag-ingat ka sana

Sa'pag tulog ko'y, larawan mo
Ang nasa, tabi ko
Umaasang
Sa pangarap ko'y
Kasama ka
Di ako nag-iisa
Tulad ngaong malayo ka

I love you boy
Mata ko'y lumuluha
Boy, sana ay narito ka
Sana'y umabot sa iyo
Ang munting himig ko
Damdaming di mahinto
Ikaw ay iniibig ko
Hello boy
Hello boy
Mag-ingat ka sana

Sa'pag tulog ko'y, larawan mo
Ang nasa, tabi ko
Umaasang
Sa pangarap ko'y
Kasama ka
Di ako nag-iisa
Tulad ngaong malayo ka

I love you boy
Mata ko'y lumuluha
Boy, sana ay narito ka
Sana'y umabot sa iyo
Ang munting himig ko
Damdaming di mahinto
Ikaw ay iniibig ko
Hello boy
Hello boy
Mag-ingat ka sana
"
"""Kapag Tumibok Ang Puso""",Donna Cruz,"""Donna""","

Heto na naman naririnig
Kumakaba-kaba itong dibdib
Lagi nalang sinasabi
Pwede ka bang makatabi?
Kahit sandali lang pweda ba
Sana pagbigyan sige na?
Muhkang tinamaan yata ako...

Kapag tumibok ang puso
Wala ka nang magagawa kundi sundin ito
Kapag tumibok ang puso
Lagot ka na
Siguradong huli ka...

Araw at gabi iniisip ka
Pinapangarap na mahagkan kita
Laging tulala at nakangiti
Puso'y di mapigil ang pintig
Nais kong sabihin, mahal ka
Bawat sandali ay miss kita
Mukhang tinamaan yata ako...

Kapag tumibok ang puso
Wala ka nang magagawa kundi sundin ito
Kapag tumibok ang puso
Lagot ka na
Siguradong huli ka...
"
"""Nais Ko""",Donna Cruz,"""Donna""","

Laging ikaw sa isip ko
Di nawawalay sa puso ko
Araw gabi hanap hanap kita
Pag ibig ba ang nadarama

Sa pagtulog ay naroon ka
Aking kamay hawak hawak mo pa
Nais ko sana'y wag nang magising
Ng di maglaho ang paglalambing

Nais koy muling makita ka
At sa akin sabihin na iniibig kita
Musmos man ang puso't isipan
Ang damdamin ko'y hayaan
Pag ibig pala ay ganyan

Sa pagtulog ay naroon ka
Aking kamay ay hawak hawak mo pa
Nais ko sana'y wag nang magising
Ng di maglaho ang paglalambing

Nais koy muling makita ka
At sa akin sabihin na iniibig kita
Musmos man ang puso't isipan
Ang damdamin ko'y hayaan
Pag ibig pala ay ganyan

Nais ko sana'y wag ng magising
Ng di maglaho ang paglalambing

Nais koy muling makita ka
At sa akin sabihin na iniibig kita
Musmos man ang puso't isipan
Ang damdamin ko'y hayaan
Pag ibig pala ay ganyan

Nais koy muling makita ka
At sa akin sabihin na iniibig kita
Musmos man ang puso't isipan
Ang damdamin ko'y hayaan
Pag ibig pala ay ganyan

Pag ibig pala ay ganyan
Pag ibig pala ay ganyan
"
"""Rain""",Donna Cruz,"""Donna""","

Rain gently falls whenever we say goodnight
Falling like when your out of sight
Rain follows me even in my bed
And rain is the tears that I shed

There'll be no sunshine in my life
Until you say your mine oh mine
There'll be no summer, spring or fall
Each day is like winter time
But I can never say I care
I know it won't be smart
Somebody owns your heart
It can never be mine

So it rains when your near
Knowing we can't even touch
Rain knows that I love you so much
But I know that my love
Will only cause you pain
So I'd rather live with the rain

There'll be no sunshine in my life
Until you say your mine oh mine
There'll be no summer, spring or fall
Each day is like winter time
But I can never say I care
I know it won't be smart
Somebody owns your heart
It can never be mine
...
"
"""Pakipot""",Donna Cruz,"""Donna""","

Kahit ikaw ay may pag-asa
Diba dapat mag syaga ka muna
Alam ko na mahirap na mag kamali
Kaya ma ingat sa pag pili

Kaya'y akoy pakipot sayo
Ibig kong... ibig kong subukan kung
Tunay ang pag ibig mo
Kaya'y akoy pakipot sayo
Ibig kong... ibig kong malaman na kung
Dapat kang ibigin ko

Minsan ay ibig kanang mahalin
Para pag hihirap mo ay matigil
Ngunit mas mahirap mag kamali
Kaya hindi biro ang pag pili

Kaya'y akoy pakipot sayo
Ibig kong... ibig kong subukan kung
Tunay ang pag ibig mo
Kaya'y akoy pakipot sayo
Ibig kong... ibig kong malaman na kung
Dapat kang ibigin ko

Kahit ikaw ay may pag-asa
Diba dapat mag syaga ka muna
Alam ko na mahirap na mag kamali
Kaya ma ingat sa pag pili

Kaya'y akoy pakipot sayo
Ibig kong... ibig kong subukan kung
Tunay ang pag ibig mo
Kaya'y akoy pakipot sayo
Ibig kong... ibig kong malaman na kung
Dapat kang ibigin ko

Kaya'y akoy pakipot sayo
Ibig kong... ibig kong subukan kung
Tunay ang pag ibig mo
Kaya'y akoy pakipot sayo
Ibig kong... ibig kong malaman na kung
Dapat kang ibigin ko
"
"""Sa Ilalim Ng Unan""",Donna Cruz,"""Donna""","

Bago matulog t'wing gabi
May isang bagay akong tinatabi
Mahalaga sa akin
At kapiling kong lagi
Ang isip ko'y naglalakbay
Patungo sa iyo
At ang larawan mo'ng ibinigay
Nasa ilalim ng unan ko

Ang iyong ngiting kay tamis
Walang sawang aking minamasdan
Kislap ng iyong mga mata
Maamo at anong ganda
Nais kong mapangarap ka
At makasama pa
Ang ligaya ng pag tulog ko
Nasa ilalim ng unan ko

Sa gabi ako ay masaya
Pagtulog ko'y mahimbing pa
Yaman ko ang lawaran mo
Sa ilalim ng unan ko
At pagising sa umaga
Puso't damdamin ko'y sumisigla
Larawan mong nakangiti
Sa akin ay bumabati

Ang iyong ngiting kay tamis
Walang sawang aking minamasdan
Kislap ng iyong mga mata
Maamo at anong ganda
Nais kong mapangarap ka
At makasama pa
Ang ligaya ng pag tulog ko
Nasa ilalim ng unan ko

Sa gabi ako ay masaya
Pagtulog ko'y mahimbing pa
Yaman ko ang lawaran mo
Sa ilalim ng unan ko
At pagising sa umaga
Puso't damdamin ko'y sumisigla
Larawan mong nakangiti
Sa akin ay bumabati

Ang iyong ngiting kay tamis
Walang sawang aking minamasdan
Kislap ng iyong mga mata
Maamo at anong ganda
Nais kong mapangarap ka
At makasama pa
Ang ligaya ng pag tulog ko
Nasa ilalim ng unan ko

Nais kong mapangarap ka
At makasama ka
Ang ligaya ng pagtulog ko
Nasa ilalim ng unan ko
"
"""Huwag Kang Mangako""",Donna Cruz,"""Kurot Sa Puso""","

Huwag kang mangako
Nang pag ibig na walang hanggan
Huwag kang mangako
Sa aking pusong ilang ulit nang nasaktan
Kahit matindi ang isang damdamin
Nagbabago rin
Tumitibok ngayon
Bukas kaya damdamin ay ganun pa rin?

Sapat na sakin
Ang minsan mong sabihin na ako'y iyong mahal
Kung sadyang tayo
Ang pagsuyo ay kusang magtatagal...

Please don't promise
That you'll love me
Until the end of time
Please don't promise to my heart
That's been hurt a million times
Kahit matindi ang isang damdamin
Nagbabago rin
Tumitibok ngayon
Bukas kaya damdamin ay ganun pa rin?

Yes! It's enough for me
Ang minsan mong sabihin na ako'y iyong mahal
That if you're meant for me
Our love will last until the end of time

Sapat na sakin
Ang minsan mong sabihin na ako'y iyong mahal
Kung sadyang tayo
Ang pagsuyo ay kusang magtatagal...
"
"""Alam Mo Na, Di Ba?""",Donna Cruz,"""Kurot Sa Puso""","

Iba na yata itong nararamdaman
'Di makakain, 'di makatulog man lang
Minamahal kita, 'wag sanang magtaka
Pinatibok mo ang puso kahit noon pa

Pangarap kita ha kapag ako ay gising
Tulog man ako ho panaginip ka pa rin
Tumitibok itong puso dahil narito ka
Alam kong alam mo na 'di ba?

Unang tibok ng puso kasabay ay kaba
May nangyayari sati'ng tila kakaiba
Ibigin man kita 'wag kang magtataka
Alam nating dalawa, alam mo na di ba?

Gusto kong sabihing minamahal kita
Kahit na alam kong ito'y alam mo na
Kumakaba itong dibdib nang dahil sa iyo
Di man ako kumikibo alam kong alam mo

Hinahanap kita ha sa bawat saglit
Pangalan mo lagi ang nasasambit
Pusong nagmamahal ganyan yata talaga
Alam kong alam na di ba?

Unang tibok ng puso kasabay ay kaba
May nangyayari sati'ng tila kakaiba
Ibigin man kita 'wag kang magtataka
Alam nating dalawa, alam mo na di ba?

Unang tibok ng puso kasabay ay kaba
May nangyayari sati'ng tila kakaiba
Ibigin man kita 'wag kang magtataka
Alam nating dalawa, alam mo na di ba?
"
"""Langit Na Naman""",Donna Cruz,"""Langit Na Naman""","

Wala nang iba para sa akin
Maging sa panaginip ikaw ang nais makapiling
Di pagpapalit kahit kay Richard o kay Robin
Wala nang iba para sa akin

Hindi sasaya kung wala ka
Umaga't gabi, ikaw ang nais makapiling
Sa ibang lalake hindi titingin
Wala nang iba para sa akin

Pag naisip ka (Langit na naman)
Maamoy ka lang (Langit na naman)
Sa bawat halik (Langit na naman)
Pag kapiling ka (Langit na naman)

Hindi pagpapalit kahit kay Richard o kay Robin
Wala nang iba para sa akin

Pag naisip ka (Langit na naman)
Maamoy ka lang (Langit na naman)
Sa bawat halik (Langit na naman)
Pag kapiling ka (Langit na naman)

Wala nang iba para sa akin
Sa hirap at gutom ikaw ang nais makapiling
Wala na akong ibang nanaisin
Wala nang iba para sa'kin
Ito'y ay aking uulit-ulitin wala nang iba para sa akin
"
